ai->ai_family: AF_INET, ai->ai_canonname: '8.8.8.8'
PING 8.8.8.8 (8.8.8.8) 56(84) bytes of data.
[1769710201.875569] 64 bytes from 8.8.8.8: icmp_seq=1 ident=53721 ttl=119 time=13.9 ms
[1769710201.894776] 64 bytes from 8.8.8.8: icmp_seq=2 ident=53721 ttl=119 time=19.1 ms
[1769710201.905236] 64 bytes from 8.8.8.8: icmp_seq=3 ident=53721 ttl=119 time=15.4 ms
[1769710201.925188] 64 bytes from 8.8.8.8: icmp_seq=4 ident=53721 ttl=119 time=20.2 ms
[1769710201.934799] 64 bytes from 8.8.8.8: icmp_seq=5 ident=53721 ttl=119 time=14.4 ms
[1769710201.954048] 64 bytes from 8.8.8.8: icmp_seq=6 ident=53721 ttl=119 time=18.6 ms
[1769710201.964410] 64 bytes from 8.8.8.8: icmp_seq=7 ident=53721 ttl=119 time=13.9 ms
[1769710201.983634] 64 bytes from 8.8.8.8: icmp_seq=8 ident=53721 ttl=119 time=18.1 ms
[1769710201.994045] 64 bytes from 8.8.8.8: icmp_seq=9 ident=53721 ttl=119 time=13.4 ms
[1769710202.013141] 64 bytes from 8.8.8.8: icmp_seq=10 ident=53721 ttl=119 time=17.5 ms
[1769710202.022862] 64 bytes from 8.8.8.8: icmp_seq=11 ident=53721 ttl=119 time=12.1 ms
[1769710202.042821] 64 bytes from 8.8.8.8: icmp_seq=12 ident=53721 ttl=119 time=17.1 ms
[1769710202.053226] 64 bytes from 8.8.8.8: icmp_seq=13 ident=53721 ttl=119 time=12.4 ms
[1769710202.073217] 64 bytes from 8.8.8.8: icmp_seq=14 ident=53721 ttl=119 time=17.4 ms
[1769710202.082066] 64 bytes from 8.8.8.8: icmp_seq=15 ident=53721 ttl=119 time=11.1 ms
[1769710202.101957] 64 bytes from 8.8.8.8: icmp_seq=16 ident=53721 ttl=119 time=16.0 ms
[1769710202.112460] 64 bytes from 8.8.8.8: icmp_seq=17 ident=53721 ttl=119 time=11.4 ms
[1769710202.131586] 64 bytes from 8.8.8.8: icmp_seq=18 ident=53721 ttl=119 time=15.5 ms
[1769710202.150830] 64 bytes from 8.8.8.8: icmp_seq=19 ident=53721 ttl=119 time=19.6 ms
[1769710202.161250] 64 bytes from 8.8.8.8: icmp_seq=20 ident=53721 ttl=119 time=14.5 ms

--- 8.8.8.8 ping statistics ---
20 packets transmitted, 20 received, 0% packet loss, time 285ms
rtt min/avg/max/mdev = 11.079/15.573/20.208/2.722 ms, pipe 2, ipg/ewma 15.009/15.177 ms
ping: sock4.fd: 3 (socktype: SOCK_RAW), sock6.fd: 4 (socktype: SOCK_RAW), hints.ai_family: AF_UNSPEC

ai->ai_family: AF_INET, ai->ai_canonname: '8.8.8.8'
PING 8.8.8.8 (8.8.8.8) 56(84) bytes of data.
[1769710202.201323] 64 bytes from 8.8.8.8: icmp_seq=1 ident=53726 ttl=119 time=16.0 ms
[1769710202.219662] 64 bytes from 8.8.8.8: icmp_seq=2 ident=53726 ttl=119 time=18.2 ms
[1769710202.230100] 64 bytes from 8.8.8.8: icmp_seq=3 ident=53726 ttl=119 time=12.5 ms
[1769710202.250043] 64 bytes from 8.8.8.8: icmp_seq=4 ident=53726 ttl=119 time=16.5 ms
[1769710202.260499] 64 bytes from 8.8.8.8: icmp_seq=5 ident=53726 ttl=119 time=10.8 ms
[1769710202.278908] 64 bytes from 8.8.8.8: icmp_seq=6 ident=53726 ttl=119 time=14.3 ms
[1769710202.298097] 64 bytes from 8.8.8.8: icmp_seq=7 ident=53726 ttl=119 time=18.4 ms
[1769710202.309284] 64 bytes from 8.8.8.8: icmp_seq=8 ident=53726 ttl=119 time=14.5 ms
[1769710202.328474] 64 bytes from 8.8.8.8: icmp_seq=9 ident=53726 ttl=119 time=18.7 ms
[1769710202.341635] 64 bytes from 8.8.8.8: icmp_seq=10 ident=53726 ttl=119 time=16.8 ms
[1769710202.358297] 64 bytes from 8.8.8.8: icmp_seq=11 ident=53726 ttl=119 time=16.6 ms
[1769710202.378101] 64 bytes from 8.8.8.8: icmp_seq=12 ident=53726 ttl=119 time=20.3 ms
[1769710202.388516] 64 bytes from 8.8.8.8: icmp_seq=13 ident=53726 ttl=119 time=14.0 ms
[1769710202.406817] 64 bytes from 8.8.8.8: icmp_seq=14 ident=53726 ttl=119 time=16.3 ms
[1769710202.417227] 64 bytes from 8.8.8.8: icmp_seq=15 ident=53726 ttl=119 time=10.6 ms
[1769710202.437335] 64 bytes from 8.8.8.8: icmp_seq=16 ident=53726 ttl=119 time=14.7 ms
[1769710202.456507] 64 bytes from 8.8.8.8: icmp_seq=17 ident=53726 ttl=119 time=18.9 ms
[1769710202.466101] 64 bytes from 8.8.8.8: icmp_seq=18 ident=53726 ttl=119 time=13.4 ms
[1769710202.485311] 64 bytes from 8.8.8.8: icmp_seq=19 ident=53726 ttl=119 time=16.6 ms
[1769710202.495730] 64 bytes from 8.8.8.8: icmp_seq=20 ident=53726 ttl=119 time=10.9 ms

--- 8.8.8.8 ping statistics ---
20 packets transmitted, 20 received, 0% packet loss, time 300ms
rtt min/avg/max/mdev = 10.638/15.458/20.269/2.753 ms, pipe 2, ipg/ewma 15.766/15.097 ms
ping: sock4.fd: 3 (socktype: SOCK_RAW), sock6.fd: 4 (socktype: SOCK_RAW), hints.ai_family: AF_UNSPEC

ai->ai_family: AF_INET, ai->ai_canonname: '8.8.8.8'
PING 8.8.8.8 (8.8.8.8) 56(84) bytes of data.
[1769710203.992398] 64 bytes from 8.8.8.8: icmp_seq=1 ident=53738 ttl=119 time=16.1 ms
[1769710204.011601] 64 bytes from 8.8.8.8: icmp_seq=2 ident=53738 ttl=119 time=19.1 ms
[1769710204.022002] 64 bytes from 8.8.8.8: icmp_seq=3 ident=53738 ttl=119 time=13.4 ms
[1769710204.041941] 64 bytes from 8.8.8.8: icmp_seq=4 ident=53738 ttl=119 time=17.4 ms
[1769710204.051601] 64 bytes from 8.8.8.8: icmp_seq=5 ident=53738 ttl=119 time=10.9 ms
[1769710204.070815] 64 bytes from 8.8.8.8: icmp_seq=6 ident=53738 ttl=119 time=14.1 ms
[1769710204.090803] 64 bytes from 8.8.8.8: icmp_seq=7 ident=53738 ttl=119 time=19.1 ms
[1769710204.101242] 64 bytes from 8.8.8.8: icmp_seq=8 ident=53738 ttl=119 time=14.5 ms
[1769710204.120331] 64 bytes from 8.8.8.8: icmp_seq=9 ident=53738 ttl=119 time=17.5 ms
[1769710204.130024] 64 bytes from 8.8.8.8: icmp_seq=10 ident=53738 ttl=119 time=11.1 ms
[1769710204.149982] 64 bytes from 8.8.8.8: icmp_seq=11 ident=53738 ttl=119 time=17.1 ms
[1769710204.160432] 64 bytes from 8.8.8.8: icmp_seq=12 ident=53738 ttl=119 time=12.4 ms
[1769710204.179538] 64 bytes from 8.8.8.8: icmp_seq=13 ident=53738 ttl=119 time=16.5 ms
[1769710204.189248] 64 bytes from 8.8.8.8: icmp_seq=14 ident=53738 ttl=119 time=11.1 ms
[1769710204.209150] 64 bytes from 8.8.8.8: icmp_seq=15 ident=53738 ttl=119 time=16.0 ms
[1769710204.218845] 64 bytes from 8.8.8.8: icmp_seq=16 ident=53738 ttl=119 time=10.6 ms
[1769710204.238917] 64 bytes from 8.8.8.8: icmp_seq=17 ident=53738 ttl=119 time=16.7 ms
[1769710204.248450] 64 bytes from 8.8.8.8: icmp_seq=18 ident=53738 ttl=119 time=12.1 ms
[1769710204.267636] 64 bytes from 8.8.8.8: icmp_seq=19 ident=53738 ttl=119 time=17.3 ms
[1769710204.278073] 64 bytes from 8.8.8.8: icmp_seq=20 ident=53738 ttl=119 time=13.6 ms

--- 8.8.8.8 ping statistics ---
20 packets transmitted, 20 received, 0% packet loss, time 288ms
rtt min/avg/max/mdev = 10.607/14.836/19.140/2.730 ms, pipe 2, ipg/ewma 15.166/14.586 ms
