ai->ai_family: AF_INET, ai->ai_canonname: '8.8.8.8'
PING 8.8.8.8 (8.8.8.8) 56(84) bytes of data.
[1770027002.011237] 64 bytes from 8.8.8.8: icmp_seq=1 ident=43879 ttl=119 time=15.5 ms
[1770027002.021627] 64 bytes from 8.8.8.8: icmp_seq=2 ident=43879 ttl=119 time=10.3 ms
[1770027002.039927] 64 bytes from 8.8.8.8: icmp_seq=3 ident=43879 ttl=119 time=13.6 ms
[1770027002.060005] 64 bytes from 8.8.8.8: icmp_seq=4 ident=43879 ttl=119 time=18.6 ms
[1770027002.071185] 64 bytes from 8.8.8.8: icmp_seq=5 ident=43879 ttl=119 time=14.7 ms
[1770027002.091196] 64 bytes from 8.8.8.8: icmp_seq=6 ident=43879 ttl=119 time=19.8 ms
[1770027002.099200] 64 bytes from 8.8.8.8: icmp_seq=7 ident=43879 ttl=119 time=12.6 ms
[1770027002.119212] 64 bytes from 8.8.8.8: icmp_seq=8 ident=43879 ttl=119 time=17.7 ms
[1770027002.130423] 64 bytes from 8.8.8.8: icmp_seq=9 ident=43879 ttl=119 time=13.8 ms
[1770027002.149621] 64 bytes from 8.8.8.8: icmp_seq=10 ident=43879 ttl=119 time=17.9 ms
[1770027002.159239] 64 bytes from 8.8.8.8: icmp_seq=11 ident=43879 ttl=119 time=12.4 ms
[1770027002.179272] 64 bytes from 8.8.8.8: icmp_seq=12 ident=43879 ttl=119 time=17.5 ms
[1770027002.188037] 64 bytes from 8.8.8.8: icmp_seq=13 ident=43879 ttl=119 time=11.1 ms
[1770027002.208104] 64 bytes from 8.8.8.8: icmp_seq=14 ident=43879 ttl=119 time=16.2 ms
[1770027002.218652] 64 bytes from 8.8.8.8: icmp_seq=15 ident=43879 ttl=119 time=11.6 ms
[1770027002.238478] 64 bytes from 8.8.8.8: icmp_seq=16 ident=43879 ttl=119 time=16.4 ms
[1770027002.258636] 64 bytes from 8.8.8.8: icmp_seq=17 ident=43879 ttl=119 time=21.5 ms
[1770027002.267421] 64 bytes from 8.8.8.8: icmp_seq=18 ident=43879 ttl=119 time=14.7 ms
[1770027002.287270] 64 bytes from 8.8.8.8: icmp_seq=19 ident=43879 ttl=119 time=18.6 ms
[1770027002.296133] 64 bytes from 8.8.8.8: icmp_seq=20 ident=43879 ttl=119 time=11.3 ms

--- 8.8.8.8 ping statistics ---
20 packets transmitted, 20 received, 0% packet loss, time 289ms
rtt min/avg/max/mdev = 10.250/15.293/21.480/3.104 ms, pipe 2, ipg/ewma 15.212/15.411 ms
ping: sock4.fd: 3 (socktype: SOCK_RAW), sock6.fd: 4 (socktype: SOCK_RAW), hints.ai_family: AF_UNSPEC

ai->ai_family: AF_INET, ai->ai_canonname: '8.8.8.8'
PING 8.8.8.8 (8.8.8.8) 56(84) bytes of data.
[1770027002.335345] 64 bytes from 8.8.8.8: icmp_seq=1 ident=43884 ttl=119 time=16.3 ms
[1770027002.346538] 64 bytes from 8.8.8.8: icmp_seq=2 ident=43884 ttl=119 time=11.1 ms
[1770027002.366521] 64 bytes from 8.8.8.8: icmp_seq=3 ident=43884 ttl=119 time=15.1 ms
[1770027002.386528] 64 bytes from 8.8.8.8: icmp_seq=4 ident=43884 ttl=119 time=19.1 ms
[1770027002.395343] 64 bytes from 8.8.8.8: icmp_seq=5 ident=43884 ttl=119 time=11.8 ms
[1770027002.415294] 64 bytes from 8.8.8.8: icmp_seq=6 ident=43884 ttl=119 time=16.7 ms
[1770027002.424146] 64 bytes from 8.8.8.8: icmp_seq=7 ident=43884 ttl=119 time=10.5 ms
[1770027002.444128] 64 bytes from 8.8.8.8: icmp_seq=8 ident=43884 ttl=119 time=15.5 ms
[1770027002.455319] 64 bytes from 8.8.8.8: icmp_seq=9 ident=43884 ttl=119 time=11.5 ms
[1770027002.474514] 64 bytes from 8.8.8.8: icmp_seq=10 ident=43884 ttl=119 time=15.7 ms
[1770027002.494538] 64 bytes from 8.8.8.8: icmp_seq=11 ident=43884 ttl=119 time=20.6 ms
[1770027002.502668] 64 bytes from 8.8.8.8: icmp_seq=12 ident=43884 ttl=119 time=13.0 ms
[1770027002.522552] 64 bytes from 8.8.8.8: icmp_seq=13 ident=43884 ttl=119 time=17.8 ms
[1770027002.533792] 64 bytes from 8.8.8.8: icmp_seq=14 ident=43884 ttl=119 time=14.0 ms
[1770027002.552147] 64 bytes from 8.8.8.8: icmp_seq=15 ident=43884 ttl=119 time=17.3 ms
[1770027002.563903] 64 bytes from 8.8.8.8: icmp_seq=16 ident=43884 ttl=119 time=14.0 ms
[1770027002.582562] 64 bytes from 8.8.8.8: icmp_seq=17 ident=43884 ttl=119 time=17.6 ms
[1770027002.592187] 64 bytes from 8.8.8.8: icmp_seq=18 ident=43884 ttl=119 time=12.1 ms
[1770027002.611345] 64 bytes from 8.8.8.8: icmp_seq=19 ident=43884 ttl=119 time=16.3 ms
[1770027002.622581] 64 bytes from 8.8.8.8: icmp_seq=20 ident=43884 ttl=119 time=12.4 ms

--- 8.8.8.8 ping statistics ---
20 packets transmitted, 20 received, 0% packet loss, time 291ms
rtt min/avg/max/mdev = 10.470/14.907/20.619/2.785 ms, pipe 2, ipg/ewma 15.326/14.962 ms
ping: sock4.fd: 3 (socktype: SOCK_RAW), sock6.fd: 4 (socktype: SOCK_RAW), hints.ai_family: AF_UNSPEC

ai->ai_family: AF_INET, ai->ai_canonname: '8.8.8.8'
PING 8.8.8.8 (8.8.8.8) 56(84) bytes of data.
[1770027003.162964] 64 bytes from 8.8.8.8: icmp_seq=1 ident=43896 ttl=119 time=14.2 ms
[1770027003.174176] 64 bytes from 8.8.8.8: icmp_seq=2 ident=43896 ttl=119 time=11.1 ms
[1770027003.192480] 64 bytes from 8.8.8.8: icmp_seq=3 ident=43896 ttl=119 time=15.4 ms
[1770027003.202963] 64 bytes from 8.8.8.8: icmp_seq=4 ident=43896 ttl=119 time=11.8 ms
[1770027003.222951] 64 bytes from 8.8.8.8: icmp_seq=5 ident=43896 ttl=119 time=17.8 ms
[1770027003.231824] 64 bytes from 8.8.8.8: icmp_seq=6 ident=43896 ttl=119 time=12.5 ms
[1770027003.251826] 64 bytes from 8.8.8.8: icmp_seq=7 ident=43896 ttl=119 time=18.5 ms
[1770027003.262963] 64 bytes from 8.8.8.8: icmp_seq=8 ident=43896 ttl=119 time=15.6 ms
[1770027003.282142] 64 bytes from 8.8.8.8: icmp_seq=9 ident=43896 ttl=119 time=19.1 ms
[1770027003.291177] 64 bytes from 8.8.8.8: icmp_seq=10 ident=43896 ttl=119 time=13.0 ms
[1770027003.310946] 64 bytes from 8.8.8.8: icmp_seq=11 ident=43896 ttl=119 time=17.8 ms
[1770027003.320607] 64 bytes from 8.8.8.8: icmp_seq=12 ident=43896 ttl=119 time=12.3 ms
[1770027003.340557] 64 bytes from 8.8.8.8: icmp_seq=13 ident=43896 ttl=119 time=17.3 ms
[1770027003.350990] 64 bytes from 8.8.8.8: icmp_seq=14 ident=43896 ttl=119 time=12.6 ms
[1770027003.370950] 64 bytes from 8.8.8.8: icmp_seq=15 ident=43896 ttl=119 time=17.6 ms
[1770027003.379819] 64 bytes from 8.8.8.8: icmp_seq=16 ident=43896 ttl=119 time=11.3 ms
[1770027003.399074] 64 bytes from 8.8.8.8: icmp_seq=17 ident=43896 ttl=119 time=15.6 ms
[1770027003.410227] 64 bytes from 8.8.8.8: icmp_seq=18 ident=43896 ttl=119 time=11.6 ms
[1770027003.430190] 64 bytes from 8.8.8.8: icmp_seq=19 ident=43896 ttl=119 time=17.6 ms
[1770027003.439007] 64 bytes from 8.8.8.8: icmp_seq=20 ident=43896 ttl=119 time=12.3 ms

--- 8.8.8.8 ping statistics ---
20 packets transmitted, 20 received, 0% packet loss, time 278ms
rtt min/avg/max/mdev = 11.105/14.739/19.080/2.683 ms, pipe 2, ipg/ewma 14.631/14.513 ms
