ai->ai_family: AF_INET, ai->ai_canonname: '8.8.8.8'
PING 8.8.8.8 (8.8.8.8) 56(84) bytes of data.
[1767305401.422005] 64 bytes from 8.8.8.8: icmp_seq=1 ident=4940 ttl=119 time=11.3 ms
[1767305401.438860] 64 bytes from 8.8.8.8: icmp_seq=2 ident=4940 ttl=119 time=16.7 ms
[1767305401.450013] 64 bytes from 8.8.8.8: icmp_seq=3 ident=4940 ttl=119 time=16.8 ms
[1767305401.470037] 64 bytes from 8.8.8.8: icmp_seq=4 ident=4940 ttl=119 time=21.0 ms
[1767305401.477990] 64 bytes from 8.8.8.8: icmp_seq=5 ident=4940 ttl=119 time=15.8 ms
[1767305401.489993] 64 bytes from 8.8.8.8: icmp_seq=6 ident=4940 ttl=119 time=11.9 ms
[1767305401.510025] 64 bytes from 8.8.8.8: icmp_seq=7 ident=4940 ttl=119 time=17.9 ms
[1767305401.518030] 64 bytes from 8.8.8.8: icmp_seq=8 ident=4940 ttl=119 time=11.8 ms
[1767305401.538045] 64 bytes from 8.8.8.8: icmp_seq=9 ident=4940 ttl=119 time=17.9 ms
[1767305401.546881] 64 bytes from 8.8.8.8: icmp_seq=10 ident=4940 ttl=119 time=12.6 ms
[1767305401.566873] 64 bytes from 8.8.8.8: icmp_seq=11 ident=4940 ttl=119 time=18.6 ms
[1767305401.578037] 64 bytes from 8.8.8.8: icmp_seq=12 ident=4940 ttl=119 time=15.6 ms
[1767305401.598066] 64 bytes from 8.8.8.8: icmp_seq=13 ident=4940 ttl=119 time=20.0 ms
[1767305401.606112] 64 bytes from 8.8.8.8: icmp_seq=14 ident=4940 ttl=119 time=12.9 ms
[1767305401.626082] 64 bytes from 8.8.8.8: icmp_seq=15 ident=4940 ttl=119 time=17.8 ms
[1767305401.638081] 64 bytes from 8.8.8.8: icmp_seq=16 ident=4940 ttl=119 time=14.7 ms
[1767305401.658081] 64 bytes from 8.8.8.8: icmp_seq=17 ident=4940 ttl=119 time=19.7 ms
[1767305401.665284] 64 bytes from 8.8.8.8: icmp_seq=18 ident=4940 ttl=119 time=11.8 ms
[1767305401.686081] 64 bytes from 8.8.8.8: icmp_seq=19 ident=4940 ttl=119 time=17.6 ms
[1767305401.694879] 64 bytes from 8.8.8.8: icmp_seq=20 ident=4940 ttl=119 time=11.3 ms

--- 8.8.8.8 ping statistics ---
20 packets transmitted, 20 received, 0% packet loss, time 273ms
rtt min/avg/max/mdev = 11.294/15.688/20.961/3.102 ms, pipe 2, ipg/ewma 14.364/15.145 ms
ping: sock4.fd: 3 (socktype: SOCK_RAW), sock6.fd: 4 (socktype: SOCK_RAW), hints.ai_family: AF_UNSPEC

ai->ai_family: AF_INET, ai->ai_canonname: '8.8.8.8'
PING 8.8.8.8 (8.8.8.8) 56(84) bytes of data.
[1767305401.734135] 64 bytes from 8.8.8.8: icmp_seq=1 ident=4945 ttl=119 time=16.2 ms
[1767305401.745336] 64 bytes from 8.8.8.8: icmp_seq=2 ident=4945 ttl=119 time=11.1 ms
[1767305401.765472] 64 bytes from 8.8.8.8: icmp_seq=3 ident=4945 ttl=119 time=15.2 ms
[1767305401.785480] 64 bytes from 8.8.8.8: icmp_seq=4 ident=4945 ttl=119 time=19.9 ms
[1767305401.793331] 64 bytes from 8.8.8.8: icmp_seq=5 ident=4945 ttl=119 time=12.7 ms
[1767305401.813305] 64 bytes from 8.8.8.8: icmp_seq=6 ident=4945 ttl=119 time=16.6 ms
[1767305401.833354] 64 bytes from 8.8.8.8: icmp_seq=7 ident=4945 ttl=119 time=20.6 ms
[1767305401.842174] 64 bytes from 8.8.8.8: icmp_seq=8 ident=4945 ttl=119 time=12.7 ms
[1767305401.864355] 64 bytes from 8.8.8.8: icmp_seq=9 ident=4945 ttl=119 time=18.9 ms
[1767305401.882285] 64 bytes from 8.8.8.8: icmp_seq=10 ident=4945 ttl=119 time=20.7 ms
[1767305401.894307] 64 bytes from 8.8.8.8: icmp_seq=11 ident=4945 ttl=119 time=15.7 ms
[1767305401.913389] 64 bytes from 8.8.8.8: icmp_seq=12 ident=4945 ttl=119 time=17.8 ms
[1767305401.930983] 64 bytes from 8.8.8.8: icmp_seq=13 ident=4945 ttl=119 time=18.3 ms
[1767305401.942306] 64 bytes from 8.8.8.8: icmp_seq=14 ident=4945 ttl=119 time=11.7 ms
[1767305401.961409] 64 bytes from 8.8.8.8: icmp_seq=15 ident=4945 ttl=119 time=14.8 ms
[1767305401.981470] 64 bytes from 8.8.8.8: icmp_seq=16 ident=4945 ttl=119 time=18.9 ms
[1767305401.990205] 64 bytes from 8.8.8.8: icmp_seq=17 ident=4945 ttl=119 time=11.5 ms
[1767305402.010204] 64 bytes from 8.8.8.8: icmp_seq=18 ident=4945 ttl=119 time=15.5 ms
[1767305402.021394] 64 bytes from 8.8.8.8: icmp_seq=19 ident=4945 ttl=119 time=10.7 ms
[1767305402.042244] 64 bytes from 8.8.8.8: icmp_seq=20 ident=4945 ttl=119 time=16.5 ms

--- 8.8.8.8 ping statistics ---
20 packets transmitted, 20 received, 0% packet loss, time 308ms
rtt min/avg/max/mdev = 10.676/15.801/20.705/3.153 ms, pipe 2, ipg/ewma 16.198/15.350 ms
ping: sock4.fd: 3 (socktype: SOCK_RAW), sock6.fd: 4 (socktype: SOCK_RAW), hints.ai_family: AF_UNSPEC

ai->ai_family: AF_INET, ai->ai_canonname: '8.8.8.8'
PING 8.8.8.8 (8.8.8.8) 56(84) bytes of data.
[1767305402.994808] 64 bytes from 8.8.8.8: icmp_seq=1 ident=4957 ttl=119 time=12.8 ms
[1767305403.005911] 64 bytes from 8.8.8.8: icmp_seq=2 ident=4957 ttl=119 time=10.9 ms
[1767305403.025930] 64 bytes from 8.8.8.8: icmp_seq=3 ident=4957 ttl=119 time=17.9 ms
[1767305403.033941] 64 bytes from 8.8.8.8: icmp_seq=4 ident=4957 ttl=119 time=12.8 ms
[1767305403.045932] 64 bytes from 8.8.8.8: icmp_seq=5 ident=4957 ttl=119 time=11.8 ms
[1767305403.065929] 64 bytes from 8.8.8.8: icmp_seq=6 ident=4957 ttl=119 time=18.8 ms
[1767305403.073907] 64 bytes from 8.8.8.8: icmp_seq=7 ident=4957 ttl=119 time=13.7 ms
[1767305403.085951] 64 bytes from 8.8.8.8: icmp_seq=8 ident=4957 ttl=119 time=11.7 ms
[1767305403.102695] 64 bytes from 8.8.8.8: icmp_seq=9 ident=4957 ttl=119 time=15.5 ms
[1767305403.113935] 64 bytes from 8.8.8.8: icmp_seq=10 ident=4957 ttl=119 time=13.6 ms
[1767305403.133936] 64 bytes from 8.8.8.8: icmp_seq=11 ident=4957 ttl=119 time=19.6 ms
[1767305403.141970] 64 bytes from 8.8.8.8: icmp_seq=12 ident=4957 ttl=119 time=13.5 ms
[1767305403.153974] 64 bytes from 8.8.8.8: icmp_seq=13 ident=4957 ttl=119 time=11.5 ms
[1767305403.173938] 64 bytes from 8.8.8.8: icmp_seq=14 ident=4957 ttl=119 time=17.5 ms
[1767305403.181971] 64 bytes from 8.8.8.8: icmp_seq=15 ident=4957 ttl=119 time=11.4 ms
[1767305403.201948] 64 bytes from 8.8.8.8: icmp_seq=16 ident=4957 ttl=119 time=17.4 ms
[1767305403.211595] 64 bytes from 8.8.8.8: icmp_seq=17 ident=4957 ttl=119 time=12.9 ms
[1767305403.230745] 64 bytes from 8.8.8.8: icmp_seq=18 ident=4957 ttl=119 time=18.1 ms
[1767305403.241934] 64 bytes from 8.8.8.8: icmp_seq=19 ident=4957 ttl=119 time=15.2 ms
[1767305403.261955] 64 bytes from 8.8.8.8: icmp_seq=20 ident=4957 ttl=119 time=20.0 ms

--- 8.8.8.8 ping statistics ---
20 packets transmitted, 20 received, 0% packet loss, time 260ms
rtt min/avg/max/mdev = 10.920/14.836/20.009/2.937 ms, pipe 2, ipg/ewma 13.682/15.444 ms
ping: sock4.fd: 3 (socktype: SOCK_RAW), sock6.fd: 4 (socktype: SOCK_RAW), hints.ai_family: AF_UNSPEC

ai->ai_family: AF_INET, ai->ai_canonname: '8.8.8.8'
PING 8.8.8.8 (8.8.8.8) 56(84) bytes of data.
[1767305420.649988] 64 bytes from 8.8.8.8: icmp_seq=1 ident=5748 ttl=119 time=12.9 ms
[1767305420.669969] 64 bytes from 8.8.8.8: icmp_seq=2 ident=5748 ttl=119 time=19.9 ms
[1767305420.677967] 64 bytes from 8.8.8.8: icmp_seq=3 ident=5748 ttl=119 time=14.7 ms
[1767305420.690002] 64 bytes from 8.8.8.8: icmp_seq=4 ident=5748 ttl=119 time=11.9 ms
[1767305420.709943] 64 bytes from 8.8.8.8: icmp_seq=5 ident=5748 ttl=119 time=17.9 ms
[1767305420.717946] 64 bytes from 8.8.8.8: icmp_seq=6 ident=5748 ttl=119 time=11.8 ms
[1767305420.738005] 64 bytes from 8.8.8.8: icmp_seq=7 ident=5748 ttl=119 time=17.8 ms
[1767305420.747577] 64 bytes from 8.8.8.8: icmp_seq=8 ident=5748 ttl=119 time=13.3 ms
[1767305420.766765] 64 bytes from 8.8.8.8: icmp_seq=9 ident=5748 ttl=119 time=18.5 ms
[1767305420.777933] 64 bytes from 8.8.8.8: icmp_seq=10 ident=5748 ttl=119 time=15.6 ms
[1767305420.798020] 64 bytes from 8.8.8.8: icmp_seq=11 ident=5748 ttl=119 time=20.1 ms
[1767305420.806028] 64 bytes from 8.8.8.8: icmp_seq=12 ident=5748 ttl=119 time=12.9 ms
[1767305420.826084] 64 bytes from 8.8.8.8: icmp_seq=13 ident=5748 ttl=119 time=18.0 ms
[1767305420.838163] 64 bytes from 8.8.8.8: icmp_seq=14 ident=5748 ttl=119 time=14.9 ms
[1767305420.858054] 64 bytes from 8.8.8.8: icmp_seq=15 ident=5748 ttl=119 time=19.8 ms
[1767305420.866028] 64 bytes from 8.8.8.8: icmp_seq=16 ident=5748 ttl=119 time=12.6 ms
[1767305420.885988] 64 bytes from 8.8.8.8: icmp_seq=17 ident=5748 ttl=119 time=16.6 ms
[1767305420.906014] 64 bytes from 8.8.8.8: icmp_seq=18 ident=5748 ttl=119 time=20.5 ms
[1767305420.914825] 64 bytes from 8.8.8.8: icmp_seq=19 ident=5748 ttl=119 time=12.6 ms
[1767305420.934039] 64 bytes from 8.8.8.8: icmp_seq=20 ident=5748 ttl=119 time=15.8 ms

--- 8.8.8.8 ping statistics ---
20 packets transmitted, 20 received, 0% packet loss, time 281ms
rtt min/avg/max/mdev = 11.753/15.900/20.509/2.915 ms, pipe 2, ipg/ewma 14.796/15.846 ms
