ai->ai_family: AF_INET, ai->ai_canonname: '8.8.8.8'
PING 8.8.8.8 (8.8.8.8) 56(84) bytes of data.
[1766985001.362302] 64 bytes from 8.8.8.8: icmp_seq=1 ident=43574 ttl=119 time=17.5 ms
[1766985001.382262] 64 bytes from 8.8.8.8: icmp_seq=2 ident=43574 ttl=119 time=19.5 ms
[1766985001.391148] 64 bytes from 8.8.8.8: icmp_seq=3 ident=43574 ttl=119 time=10.3 ms
[1766985001.410344] 64 bytes from 8.8.8.8: icmp_seq=4 ident=43574 ttl=119 time=12.4 ms
[1766985001.430301] 64 bytes from 8.8.8.8: icmp_seq=5 ident=43574 ttl=119 time=16.4 ms
[1766985001.439929] 64 bytes from 8.8.8.8: icmp_seq=6 ident=43574 ttl=119 time=9.93 ms
[1766985001.460018] 64 bytes from 8.8.8.8: icmp_seq=7 ident=43574 ttl=119 time=14.0 ms
[1766985001.479923] 64 bytes from 8.8.8.8: icmp_seq=8 ident=43574 ttl=119 time=18.9 ms
[1766985001.490317] 64 bytes from 8.8.8.8: icmp_seq=9 ident=43574 ttl=119 time=14.2 ms
[1766985001.510437] 64 bytes from 8.8.8.8: icmp_seq=10 ident=43574 ttl=119 time=18.3 ms
[1766985001.519232] 64 bytes from 8.8.8.8: icmp_seq=11 ident=43574 ttl=119 time=11.0 ms
[1766985001.538419] 64 bytes from 8.8.8.8: icmp_seq=12 ident=43574 ttl=119 time=15.2 ms
[1766985001.549690] 64 bytes from 8.8.8.8: icmp_seq=13 ident=43574 ttl=119 time=11.4 ms
[1766985001.568137] 64 bytes from 8.8.8.8: icmp_seq=14 ident=43574 ttl=119 time=14.8 ms
[1766985001.587986] 64 bytes from 8.8.8.8: icmp_seq=15 ident=43574 ttl=119 time=19.7 ms
[1766985001.598386] 64 bytes from 8.8.8.8: icmp_seq=16 ident=43574 ttl=119 time=15.0 ms
[1766985001.618365] 64 bytes from 8.8.8.8: icmp_seq=17 ident=43574 ttl=119 time=19.9 ms
[1766985001.627180] 64 bytes from 8.8.8.8: icmp_seq=18 ident=43574 ttl=119 time=13.5 ms
[1766985001.647188] 64 bytes from 8.8.8.8: icmp_seq=19 ident=43574 ttl=119 time=17.5 ms
[1766985001.657580] 64 bytes from 8.8.8.8: icmp_seq=20 ident=43574 ttl=119 time=11.8 ms

--- 8.8.8.8 ping statistics ---
20 packets transmitted, 20 received, 0% packet loss, time 301ms
rtt min/avg/max/mdev = 9.930/15.076/19.851/3.197 ms, pipe 2, ipg/ewma 15.840/15.366 ms
ping: sock4.fd: 3 (socktype: SOCK_RAW), sock6.fd: 4 (socktype: SOCK_RAW), hints.ai_family: AF_UNSPEC

ai->ai_family: AF_INET, ai->ai_canonname: '8.8.8.8'
PING 8.8.8.8 (8.8.8.8) 56(84) bytes of data.
[1766985001.696188] 64 bytes from 8.8.8.8: icmp_seq=1 ident=43579 ttl=119 time=15.9 ms
[1766985001.716143] 64 bytes from 8.8.8.8: icmp_seq=2 ident=43579 ttl=119 time=19.8 ms
[1766985001.726532] 64 bytes from 8.8.8.8: icmp_seq=3 ident=43579 ttl=119 time=14.1 ms
[1766985001.746396] 64 bytes from 8.8.8.8: icmp_seq=4 ident=43579 ttl=119 time=18.0 ms
[1766985001.755195] 64 bytes from 8.8.8.8: icmp_seq=5 ident=43579 ttl=119 time=10.7 ms
[1766985001.775197] 64 bytes from 8.8.8.8: icmp_seq=6 ident=43579 ttl=119 time=14.7 ms
[1766985001.785590] 64 bytes from 8.8.8.8: icmp_seq=7 ident=43579 ttl=119 time=10.1 ms
[1766985001.805638] 64 bytes from 8.8.8.8: icmp_seq=8 ident=43579 ttl=119 time=15.2 ms
[1766985001.823999] 64 bytes from 8.8.8.8: icmp_seq=9 ident=43579 ttl=119 time=18.4 ms
[1766985001.834445] 64 bytes from 8.8.8.8: icmp_seq=10 ident=43579 ttl=119 time=13.6 ms
[1766985001.854399] 64 bytes from 8.8.8.8: icmp_seq=11 ident=43579 ttl=119 time=18.6 ms
[1766985001.864043] 64 bytes from 8.8.8.8: icmp_seq=12 ident=43579 ttl=119 time=13.1 ms
[1766985001.883250] 64 bytes from 8.8.8.8: icmp_seq=13 ident=43579 ttl=119 time=17.3 ms
[1766985001.894432] 64 bytes from 8.8.8.8: icmp_seq=14 ident=43579 ttl=119 time=13.4 ms
[1766985001.913609] 64 bytes from 8.8.8.8: icmp_seq=15 ident=43579 ttl=119 time=17.5 ms
[1766985001.922439] 64 bytes from 8.8.8.8: icmp_seq=16 ident=43579 ttl=119 time=11.2 ms
[1766985001.942494] 64 bytes from 8.8.8.8: icmp_seq=17 ident=43579 ttl=119 time=16.3 ms
[1766985001.952231] 64 bytes from 8.8.8.8: icmp_seq=18 ident=43579 ttl=119 time=10.9 ms
[1766985001.972023] 64 bytes from 8.8.8.8: icmp_seq=19 ident=43579 ttl=119 time=15.7 ms
[1766985001.982527] 64 bytes from 8.8.8.8: icmp_seq=20 ident=43579 ttl=119 time=11.1 ms

--- 8.8.8.8 ping statistics ---
20 packets transmitted, 20 received, 0% packet loss, time 291ms
rtt min/avg/max/mdev = 10.069/14.772/19.844/2.900 ms, pipe 2, ipg/ewma 15.323/14.289 ms
ping: sock4.fd: 3 (socktype: SOCK_RAW), sock6.fd: 4 (socktype: SOCK_RAW), hints.ai_family: AF_UNSPEC

ai->ai_family: AF_INET, ai->ai_canonname: '8.8.8.8'
PING 8.8.8.8 (8.8.8.8) 56(84) bytes of data.
[1766985002.611559] 64 bytes from 8.8.8.8: icmp_seq=1 ident=43591 ttl=119 time=14.0 ms
[1766985002.622737] 64 bytes from 8.8.8.8: icmp_seq=2 ident=43591 ttl=119 time=11.1 ms
[1766985002.642690] 64 bytes from 8.8.8.8: icmp_seq=3 ident=43591 ttl=119 time=17.0 ms
[1766985002.651555] 64 bytes from 8.8.8.8: icmp_seq=4 ident=43591 ttl=119 time=11.8 ms
[1766985002.670702] 64 bytes from 8.8.8.8: icmp_seq=5 ident=43591 ttl=119 time=16.9 ms
[1766985002.681885] 64 bytes from 8.8.8.8: icmp_seq=6 ident=43591 ttl=119 time=14.0 ms
[1766985002.701907] 64 bytes from 8.8.8.8: icmp_seq=7 ident=43591 ttl=119 time=19.9 ms
[1766985002.710754] 64 bytes from 8.8.8.8: icmp_seq=8 ident=43591 ttl=119 time=14.7 ms
[1766985002.729939] 64 bytes from 8.8.8.8: icmp_seq=9 ident=43591 ttl=119 time=18.9 ms
[1766985002.739772] 64 bytes from 8.8.8.8: icmp_seq=10 ident=43591 ttl=119 time=13.6 ms
[1766985002.759750] 64 bytes from 8.8.8.8: icmp_seq=11 ident=43591 ttl=119 time=19.5 ms
[1766985002.770198] 64 bytes from 8.8.8.8: icmp_seq=12 ident=43591 ttl=119 time=14.9 ms
[1766985002.790193] 64 bytes from 8.8.8.8: icmp_seq=13 ident=43591 ttl=119 time=18.9 ms
[1766985002.799001] 64 bytes from 8.8.8.8: icmp_seq=14 ident=43591 ttl=119 time=11.6 ms
[1766985002.818887] 64 bytes from 8.8.8.8: icmp_seq=15 ident=43591 ttl=119 time=16.5 ms
[1766985002.828544] 64 bytes from 8.8.8.8: icmp_seq=16 ident=43591 ttl=119 time=11.0 ms
[1766985002.848431] 64 bytes from 8.8.8.8: icmp_seq=17 ident=43591 ttl=119 time=15.9 ms
[1766985002.859015] 64 bytes from 8.8.8.8: icmp_seq=18 ident=43591 ttl=119 time=11.4 ms
[1766985002.878948] 64 bytes from 8.8.8.8: icmp_seq=19 ident=43591 ttl=119 time=16.3 ms
[1766985002.899029] 64 bytes from 8.8.8.8: icmp_seq=20 ident=43591 ttl=119 time=21.3 ms

--- 8.8.8.8 ping statistics ---
20 packets transmitted, 20 received, 0% packet loss, time 280ms
rtt min/avg/max/mdev = 11.009/15.449/21.271/3.107 ms, pipe 2, ipg/ewma 14.745/15.647 ms
