ai->ai_family: AF_INET, ai->ai_canonname: '8.8.8.8'
PING 8.8.8.8 (8.8.8.8) 56(84) bytes of data.
[1763471401.219576] 64 bytes from 8.8.8.8: icmp_seq=1 ident=1222 ttl=119 time=12.5 ms
[1763471401.238646] 64 bytes from 8.8.8.8: icmp_seq=2 ident=1222 ttl=119 time=18.7 ms
[1763471401.247501] 64 bytes from 8.8.8.8: icmp_seq=3 ident=1222 ttl=119 time=14.4 ms
[1763471401.258748] 64 bytes from 8.8.8.8: icmp_seq=4 ident=1222 ttl=119 time=11.2 ms
[1763471401.278748] 64 bytes from 8.8.8.8: icmp_seq=5 ident=1222 ttl=119 time=18.2 ms
[1763471401.287666] 64 bytes from 8.8.8.8: icmp_seq=6 ident=1222 ttl=119 time=14.0 ms
[1763471401.307607] 64 bytes from 8.8.8.8: icmp_seq=7 ident=1222 ttl=119 time=19.9 ms
[1763471401.316417] 64 bytes from 8.8.8.8: icmp_seq=8 ident=1222 ttl=119 time=14.6 ms
[1763471401.327647] 64 bytes from 8.8.8.8: icmp_seq=9 ident=1222 ttl=119 time=10.8 ms
[1763471401.347634] 64 bytes from 8.8.8.8: icmp_seq=10 ident=1222 ttl=119 time=16.8 ms
[1763471401.355563] 64 bytes from 8.8.8.8: icmp_seq=11 ident=1222 ttl=119 time=10.6 ms
[1763471401.375528] 64 bytes from 8.8.8.8: icmp_seq=12 ident=1222 ttl=119 time=16.6 ms
[1763471401.386741] 64 bytes from 8.8.8.8: icmp_seq=13 ident=1222 ttl=119 time=13.7 ms
[1763471401.405154] 64 bytes from 8.8.8.8: icmp_seq=14 ident=1222 ttl=119 time=18.1 ms
[1763471401.415529] 64 bytes from 8.8.8.8: icmp_seq=15 ident=1222 ttl=119 time=14.4 ms
[1763471401.435539] 64 bytes from 8.8.8.8: icmp_seq=16 ident=1222 ttl=119 time=19.4 ms
[1763471401.443719] 64 bytes from 8.8.8.8: icmp_seq=17 ident=1222 ttl=119 time=12.4 ms
[1763471401.463726] 64 bytes from 8.8.8.8: icmp_seq=18 ident=1222 ttl=119 time=17.4 ms
[1763471401.475731] 64 bytes from 8.8.8.8: icmp_seq=19 ident=1222 ttl=119 time=14.3 ms
[1763471401.494824] 64 bytes from 8.8.8.8: icmp_seq=20 ident=1222 ttl=119 time=18.4 ms

--- 8.8.8.8 ping statistics ---
20 packets transmitted, 20 received, 0% packet loss, time 269ms
rtt min/avg/max/mdev = 10.638/15.326/19.873/2.877 ms, pipe 2, ipg/ewma 14.179/15.525 ms
ping: sock4.fd: 3 (socktype: SOCK_RAW), sock6.fd: 4 (socktype: SOCK_RAW), hints.ai_family: AF_UNSPEC

ai->ai_family: AF_INET, ai->ai_canonname: '8.8.8.8'
PING 8.8.8.8 (8.8.8.8) 56(84) bytes of data.
[1763471401.532431] 64 bytes from 8.8.8.8: icmp_seq=1 ident=1227 ttl=119 time=15.5 ms
[1763471401.543595] 64 bytes from 8.8.8.8: icmp_seq=2 ident=1227 ttl=119 time=11.1 ms
[1763471401.563576] 64 bytes from 8.8.8.8: icmp_seq=3 ident=1227 ttl=119 time=16.1 ms
[1763471401.583486] 64 bytes from 8.8.8.8: icmp_seq=4 ident=1227 ttl=119 time=20.9 ms
[1763471401.591628] 64 bytes from 8.8.8.8: icmp_seq=5 ident=1227 ttl=119 time=13.9 ms
[1763471401.611790] 64 bytes from 8.8.8.8: icmp_seq=6 ident=1227 ttl=119 time=18.1 ms
[1763471401.622976] 64 bytes from 8.8.8.8: icmp_seq=7 ident=1227 ttl=119 time=13.1 ms
[1763471401.641208] 64 bytes from 8.8.8.8: icmp_seq=8 ident=1227 ttl=119 time=15.4 ms
[1763471401.660415] 64 bytes from 8.8.8.8: icmp_seq=9 ident=1227 ttl=119 time=18.6 ms
[1763471401.671714] 64 bytes from 8.8.8.8: icmp_seq=10 ident=1227 ttl=119 time=13.8 ms
[1763471401.691641] 64 bytes from 8.8.8.8: icmp_seq=11 ident=1227 ttl=119 time=17.7 ms
[1763471401.711720] 64 bytes from 8.8.8.8: icmp_seq=12 ident=1227 ttl=119 time=21.7 ms
[1763471401.719682] 64 bytes from 8.8.8.8: icmp_seq=13 ident=1227 ttl=119 time=12.9 ms
[1763471401.739657] 64 bytes from 8.8.8.8: icmp_seq=14 ident=1227 ttl=119 time=16.8 ms
[1763471401.750909] 64 bytes from 8.8.8.8: icmp_seq=15 ident=1227 ttl=119 time=12.0 ms
[1763471401.769269] 64 bytes from 8.8.8.8: icmp_seq=16 ident=1227 ttl=119 time=14.3 ms
[1763471401.788469] 64 bytes from 8.8.8.8: icmp_seq=17 ident=1227 ttl=119 time=17.5 ms
[1763471401.799716] 64 bytes from 8.8.8.8: icmp_seq=18 ident=1227 ttl=119 time=12.7 ms
[1763471401.819711] 64 bytes from 8.8.8.8: icmp_seq=19 ident=1227 ttl=119 time=17.7 ms
[1763471401.827721] 64 bytes from 8.8.8.8: icmp_seq=20 ident=1227 ttl=119 time=10.6 ms

--- 8.8.8.8 ping statistics ---
20 packets transmitted, 20 received, 0% packet loss, time 300ms
rtt min/avg/max/mdev = 10.552/15.509/21.664/3.023 ms, pipe 2, ipg/ewma 15.803/15.036 ms
ping: sock4.fd: 3 (socktype: SOCK_RAW), sock6.fd: 4 (socktype: SOCK_RAW), hints.ai_family: AF_UNSPEC

ai->ai_family: AF_INET, ai->ai_canonname: '8.8.8.8'
PING 8.8.8.8 (8.8.8.8) 56(84) bytes of data.
[1763471402.903466] 64 bytes from 8.8.8.8: icmp_seq=1 ident=1239 ttl=119 time=19.7 ms
[1763471402.921049] 64 bytes from 8.8.8.8: icmp_seq=2 ident=1239 ttl=119 time=17.3 ms
[1763471402.941055] 64 bytes from 8.8.8.8: icmp_seq=3 ident=1239 ttl=119 time=18.3 ms
[1763471402.960272] 64 bytes from 8.8.8.8: icmp_seq=4 ident=1239 ttl=119 time=18.5 ms
[1763471402.971464] 64 bytes from 8.8.8.8: icmp_seq=5 ident=1239 ttl=119 time=10.7 ms
[1763471402.991468] 64 bytes from 8.8.8.8: icmp_seq=6 ident=1239 ttl=119 time=12.7 ms
[1763471403.011464] 64 bytes from 8.8.8.8: icmp_seq=7 ident=1239 ttl=119 time=15.7 ms
[1763471403.031393] 64 bytes from 8.8.8.8: icmp_seq=8 ident=1239 ttl=119 time=18.6 ms
[1763471403.049011] 64 bytes from 8.8.8.8: icmp_seq=9 ident=1239 ttl=119 time=19.1 ms
[1763471403.059492] 64 bytes from 8.8.8.8: icmp_seq=10 ident=1239 ttl=119 time=11.9 ms
[1763471403.079476] 64 bytes from 8.8.8.8: icmp_seq=11 ident=1239 ttl=119 time=14.9 ms
[1763471403.099384] 64 bytes from 8.8.8.8: icmp_seq=12 ident=1239 ttl=119 time=17.8 ms
[1763471403.119502] 64 bytes from 8.8.8.8: icmp_seq=13 ident=1239 ttl=119 time=20.8 ms
[1763471403.128233] 64 bytes from 8.8.8.8: icmp_seq=14 ident=1239 ttl=119 time=11.6 ms
[1763471403.147535] 64 bytes from 8.8.8.8: icmp_seq=15 ident=1239 ttl=119 time=13.9 ms
[1763471403.167462] 64 bytes from 8.8.8.8: icmp_seq=16 ident=1239 ttl=119 time=17.9 ms
[1763471403.177130] 64 bytes from 8.8.8.8: icmp_seq=17 ident=1239 ttl=119 time=11.4 ms
[1763471403.197168] 64 bytes from 8.8.8.8: icmp_seq=18 ident=1239 ttl=119 time=15.5 ms
[1763471403.216290] 64 bytes from 8.8.8.8: icmp_seq=19 ident=1239 ttl=119 time=18.6 ms
[1763471403.227545] 64 bytes from 8.8.8.8: icmp_seq=20 ident=1239 ttl=119 time=13.7 ms

--- 8.8.8.8 ping statistics ---
20 packets transmitted, 20 received, 0% packet loss, time 330ms
rtt min/avg/max/mdev = 10.681/15.925/20.782/3.048 ms, pipe 2, ipg/ewma 17.369/15.830 ms
ping: sock4.fd: 3 (socktype: SOCK_RAW), sock6.fd: 4 (socktype: SOCK_RAW), hints.ai_family: AF_UNSPEC

ai->ai_family: AF_INET, ai->ai_canonname: '8.8.8.8'
PING 8.8.8.8 (8.8.8.8) 56(84) bytes of data.
[1763471420.427338] 64 bytes from 8.8.8.8: icmp_seq=1 ident=2030 ttl=119 time=17.9 ms
[1763471420.439324] 64 bytes from 8.8.8.8: icmp_seq=2 ident=2030 ttl=119 time=11.9 ms
[1763471420.456923] 64 bytes from 8.8.8.8: icmp_seq=3 ident=2030 ttl=119 time=12.5 ms
[1763471420.476118] 64 bytes from 8.8.8.8: icmp_seq=4 ident=2030 ttl=119 time=14.7 ms
[1763471420.496130] 64 bytes from 8.8.8.8: icmp_seq=5 ident=2030 ttl=119 time=18.7 ms
[1763471420.507315] 64 bytes from 8.8.8.8: icmp_seq=6 ident=2030 ttl=119 time=13.8 ms
[1763471420.526491] 64 bytes from 8.8.8.8: icmp_seq=7 ident=2030 ttl=119 time=17.0 ms
[1763471420.547335] 64 bytes from 8.8.8.8: icmp_seq=8 ident=2030 ttl=119 time=21.7 ms
[1763471420.555366] 64 bytes from 8.8.8.8: icmp_seq=9 ident=2030 ttl=119 time=12.7 ms
[1763471420.574561] 64 bytes from 8.8.8.8: icmp_seq=10 ident=2030 ttl=119 time=15.9 ms
[1763471420.585006] 64 bytes from 8.8.8.8: icmp_seq=11 ident=2030 ttl=119 time=10.3 ms
[1763471420.604193] 64 bytes from 8.8.8.8: icmp_seq=12 ident=2030 ttl=119 time=13.5 ms
[1763471420.624160] 64 bytes from 8.8.8.8: icmp_seq=13 ident=2030 ttl=119 time=18.5 ms
[1763471420.634539] 64 bytes from 8.8.8.8: icmp_seq=14 ident=2030 ttl=119 time=13.7 ms
[1763471420.654566] 64 bytes from 8.8.8.8: icmp_seq=15 ident=2030 ttl=119 time=17.8 ms
[1763471420.663375] 64 bytes from 8.8.8.8: icmp_seq=16 ident=2030 ttl=119 time=10.4 ms
[1763471420.683351] 64 bytes from 8.8.8.8: icmp_seq=17 ident=2030 ttl=119 time=15.4 ms
[1763471420.694620] 64 bytes from 8.8.8.8: icmp_seq=18 ident=2030 ttl=119 time=11.6 ms
[1763471420.713010] 64 bytes from 8.8.8.8: icmp_seq=19 ident=2030 ttl=119 time=15.0 ms
[1763471420.732258] 64 bytes from 8.8.8.8: icmp_seq=20 ident=2030 ttl=119 time=19.1 ms

--- 8.8.8.8 ping statistics ---
20 packets transmitted, 20 received, 0% packet loss, time 304ms
rtt min/avg/max/mdev = 10.322/15.095/21.693/3.077 ms, pipe 2, ipg/ewma 15.982/15.291 ms
