ai->ai_family: AF_INET, ai->ai_canonname: '8.8.8.8'
PING 8.8.8.8 (8.8.8.8) 56(84) bytes of data.
[1771060201.701254] 64 bytes from 8.8.8.8: icmp_seq=1 ident=3436 ttl=119 time=13.0 ms
[1771060201.711629] 64 bytes from 8.8.8.8: icmp_seq=2 ident=3436 ttl=119 time=10.2 ms
[1771060201.730849] 64 bytes from 8.8.8.8: icmp_seq=3 ident=3436 ttl=119 time=16.5 ms
[1771060201.740441] 64 bytes from 8.8.8.8: icmp_seq=4 ident=3436 ttl=119 time=13.0 ms
[1771060201.750878] 64 bytes from 8.8.8.8: icmp_seq=5 ident=3436 ttl=119 time=10.3 ms
[1771060201.770028] 64 bytes from 8.8.8.8: icmp_seq=6 ident=3436 ttl=119 time=16.5 ms
[1771060201.779583] 64 bytes from 8.8.8.8: icmp_seq=7 ident=3436 ttl=119 time=12.9 ms
[1771060201.790062] 64 bytes from 8.8.8.8: icmp_seq=8 ident=3436 ttl=119 time=10.4 ms
[1771060201.809244] 64 bytes from 8.8.8.8: icmp_seq=9 ident=3436 ttl=119 time=16.6 ms
[1771060201.819649] 64 bytes from 8.8.8.8: icmp_seq=10 ident=3436 ttl=119 time=13.9 ms
[1771060201.838854] 64 bytes from 8.8.8.8: icmp_seq=11 ident=3436 ttl=119 time=19.4 ms
[1771060201.849186] 64 bytes from 8.8.8.8: icmp_seq=12 ident=3436 ttl=119 time=16.4 ms
[1771060201.859551] 64 bytes from 8.8.8.8: icmp_seq=13 ident=3436 ttl=119 time=10.6 ms
[1771060201.878762] 64 bytes from 8.8.8.8: icmp_seq=14 ident=3436 ttl=119 time=15.8 ms
[1771060201.888370] 64 bytes from 8.8.8.8: icmp_seq=15 ident=3436 ttl=119 time=11.3 ms
[1771060201.907547] 64 bytes from 8.8.8.8: icmp_seq=16 ident=3436 ttl=119 time=16.5 ms
[1771060201.918109] 64 bytes from 8.8.8.8: icmp_seq=17 ident=3436 ttl=119 time=13.0 ms
[1771060201.937352] 64 bytes from 8.8.8.8: icmp_seq=18 ident=3436 ttl=119 time=18.2 ms
[1771060201.947866] 64 bytes from 8.8.8.8: icmp_seq=19 ident=3436 ttl=119 time=14.6 ms
[1771060201.966907] 64 bytes from 8.8.8.8: icmp_seq=20 ident=3436 ttl=119 time=18.7 ms

--- 8.8.8.8 ping statistics ---
20 packets transmitted, 20 received, 0% packet loss, time 260ms
rtt min/avg/max/mdev = 10.249/14.387/19.439/2.867 ms, pipe 2, ipg/ewma 13.688/15.058 ms
ping: sock4.fd: 3 (socktype: SOCK_RAW), sock6.fd: 4 (socktype: SOCK_RAW), hints.ai_family: AF_UNSPEC

ai->ai_family: AF_INET, ai->ai_canonname: '8.8.8.8'
PING 8.8.8.8 (8.8.8.8) 56(84) bytes of data.
[1771060202.006855] 64 bytes from 8.8.8.8: icmp_seq=1 ident=3442 ttl=119 time=16.4 ms
[1771060202.026008] 64 bytes from 8.8.8.8: icmp_seq=2 ident=3442 ttl=119 time=19.1 ms
[1771060202.035610] 64 bytes from 8.8.8.8: icmp_seq=3 ident=3442 ttl=119 time=12.6 ms
[1771060202.055620] 64 bytes from 8.8.8.8: icmp_seq=4 ident=3442 ttl=119 time=16.6 ms
[1771060202.065263] 64 bytes from 8.8.8.8: icmp_seq=5 ident=3442 ttl=119 time=10.2 ms
[1771060202.085542] 64 bytes from 8.8.8.8: icmp_seq=6 ident=3442 ttl=119 time=15.5 ms
[1771060202.095841] 64 bytes from 8.8.8.8: icmp_seq=7 ident=3442 ttl=119 time=10.7 ms
[1771060202.115013] 64 bytes from 8.8.8.8: icmp_seq=8 ident=3442 ttl=119 time=14.9 ms
[1771060202.125280] 64 bytes from 8.8.8.8: icmp_seq=9 ident=3442 ttl=119 time=10.1 ms
[1771060202.143719] 64 bytes from 8.8.8.8: icmp_seq=10 ident=3442 ttl=119 time=14.5 ms
[1771060202.154180] 64 bytes from 8.8.8.8: icmp_seq=11 ident=3442 ttl=119 time=10.9 ms
[1771060202.173367] 64 bytes from 8.8.8.8: icmp_seq=12 ident=3442 ttl=119 time=16.1 ms
[1771060202.183765] 64 bytes from 8.8.8.8: icmp_seq=13 ident=3442 ttl=119 time=12.3 ms
[1771060202.203828] 64 bytes from 8.8.8.8: icmp_seq=14 ident=3442 ttl=119 time=18.4 ms
[1771060202.213378] 64 bytes from 8.8.8.8: icmp_seq=15 ident=3442 ttl=119 time=13.9 ms
[1771060202.223783] 64 bytes from 8.8.8.8: icmp_seq=16 ident=3442 ttl=119 time=10.3 ms
[1771060202.242969] 64 bytes from 8.8.8.8: icmp_seq=17 ident=3442 ttl=119 time=15.4 ms
[1771060202.252548] 64 bytes from 8.8.8.8: icmp_seq=18 ident=3442 ttl=119 time=10.9 ms
[1771060202.271751] 64 bytes from 8.8.8.8: icmp_seq=19 ident=3442 ttl=119 time=16.2 ms
[1771060202.282136] 64 bytes from 8.8.8.8: icmp_seq=20 ident=3442 ttl=119 time=12.5 ms

--- 8.8.8.8 ping statistics ---
20 packets transmitted, 20 received, 0% packet loss, time 279ms
rtt min/avg/max/mdev = 10.124/13.863/19.091/2.762 ms, pipe 2, ipg/ewma 14.695/13.807 ms
ping: sock4.fd: 3 (socktype: SOCK_RAW), sock6.fd: 4 (socktype: SOCK_RAW), hints.ai_family: AF_UNSPEC

ai->ai_family: AF_INET, ai->ai_canonname: '8.8.8.8'
PING 8.8.8.8 (8.8.8.8) 56(84) bytes of data.
[1771060204.113263] 64 bytes from 8.8.8.8: icmp_seq=1 ident=3454 ttl=119 time=10.4 ms
[1771060204.123509] 64 bytes from 8.8.8.8: icmp_seq=2 ident=3454 ttl=119 time=10.2 ms
[1771060204.142739] 64 bytes from 8.8.8.8: icmp_seq=3 ident=3454 ttl=119 time=19.3 ms
[1771060204.153186] 64 bytes from 8.8.8.8: icmp_seq=4 ident=3454 ttl=119 time=19.5 ms
[1771060204.162923] 64 bytes from 8.8.8.8: icmp_seq=5 ident=3454 ttl=119 time=9.99 ms
[1771060204.182981] 64 bytes from 8.8.8.8: icmp_seq=6 ident=3454 ttl=119 time=18.1 ms
[1771060204.192586] 64 bytes from 8.8.8.8: icmp_seq=7 ident=3454 ttl=119 time=15.6 ms
[1771060204.202883] 64 bytes from 8.8.8.8: icmp_seq=8 ident=3454 ttl=119 time=10.2 ms
[1771060204.222047] 64 bytes from 8.8.8.8: icmp_seq=9 ident=3454 ttl=119 time=16.4 ms
[1771060204.231654] 64 bytes from 8.8.8.8: icmp_seq=10 ident=3454 ttl=119 time=12.8 ms
[1771060204.242017] 64 bytes from 8.8.8.8: icmp_seq=11 ident=3454 ttl=119 time=10.2 ms
[1771060204.261268] 64 bytes from 8.8.8.8: icmp_seq=12 ident=3454 ttl=119 time=16.5 ms
[1771060204.270972] 64 bytes from 8.8.8.8: icmp_seq=13 ident=3454 ttl=119 time=13.1 ms
[1771060204.281256] 64 bytes from 8.8.8.8: icmp_seq=14 ident=3454 ttl=119 time=10.2 ms
[1771060204.300455] 64 bytes from 8.8.8.8: icmp_seq=15 ident=3454 ttl=119 time=16.4 ms
[1771060204.310872] 64 bytes from 8.8.8.8: icmp_seq=16 ident=3454 ttl=119 time=13.7 ms
[1771060204.330095] 64 bytes from 8.8.8.8: icmp_seq=17 ident=3454 ttl=119 time=19.4 ms
[1771060204.339679] 64 bytes from 8.8.8.8: icmp_seq=18 ident=3454 ttl=119 time=15.6 ms
[1771060204.350097] 64 bytes from 8.8.8.8: icmp_seq=19 ident=3454 ttl=119 time=10.3 ms
[1771060204.370083] 64 bytes from 8.8.8.8: icmp_seq=20 ident=3454 ttl=119 time=16.3 ms

--- 8.8.8.8 ping statistics ---
20 packets transmitted, 20 received, 0% packet loss, time 251ms
rtt min/avg/max/mdev = 9.993/14.204/19.505/3.418 ms, pipe 2, ipg/ewma 13.209/14.133 ms
ping: sock4.fd: 3 (socktype: SOCK_RAW), sock6.fd: 4 (socktype: SOCK_RAW), hints.ai_family: AF_UNSPEC

ai->ai_family: AF_INET, ai->ai_canonname: '8.8.8.8'
PING 8.8.8.8 (8.8.8.8) 56(84) bytes of data.
[1771060223.835813] 64 bytes from 8.8.8.8: icmp_seq=1 ident=4249 ttl=119 time=15.5 ms
[1771060223.855082] 64 bytes from 8.8.8.8: icmp_seq=2 ident=4249 ttl=119 time=19.1 ms
[1771060223.865492] 64 bytes from 8.8.8.8: icmp_seq=3 ident=4249 ttl=119 time=14.5 ms
[1771060223.884542] 64 bytes from 8.8.8.8: icmp_seq=4 ident=4249 ttl=119 time=17.5 ms
[1771060223.895734] 64 bytes from 8.8.8.8: icmp_seq=5 ident=4249 ttl=119 time=12.6 ms
[1771060223.915695] 64 bytes from 8.8.8.8: icmp_seq=6 ident=4249 ttl=119 time=16.6 ms
[1771060223.925311] 64 bytes from 8.8.8.8: icmp_seq=7 ident=4249 ttl=119 time=10.1 ms
[1771060223.943735] 64 bytes from 8.8.8.8: icmp_seq=8 ident=4249 ttl=119 time=13.5 ms
[1771060223.963732] 64 bytes from 8.8.8.8: icmp_seq=9 ident=4249 ttl=119 time=18.5 ms
[1771060223.973350] 64 bytes from 8.8.8.8: icmp_seq=10 ident=4249 ttl=119 time=13.0 ms
[1771060223.993341] 64 bytes from 8.8.8.8: icmp_seq=11 ident=4249 ttl=119 time=18.0 ms
[1771060224.002942] 64 bytes from 8.8.8.8: icmp_seq=12 ident=4249 ttl=119 time=12.5 ms
[1771060224.023753] 64 bytes from 8.8.8.8: icmp_seq=13 ident=4249 ttl=119 time=18.3 ms
[1771060224.032549] 64 bytes from 8.8.8.8: icmp_seq=14 ident=4249 ttl=119 time=11.9 ms
[1771060224.051664] 64 bytes from 8.8.8.8: icmp_seq=15 ident=4249 ttl=119 time=16.1 ms
[1771060224.062115] 64 bytes from 8.8.8.8: icmp_seq=16 ident=4249 ttl=119 time=11.4 ms
[1771060224.082085] 64 bytes from 8.8.8.8: icmp_seq=17 ident=4249 ttl=119 time=16.4 ms
[1771060224.091742] 64 bytes from 8.8.8.8: icmp_seq=18 ident=4249 ttl=119 time=10.9 ms
[1771060224.110995] 64 bytes from 8.8.8.8: icmp_seq=19 ident=4249 ttl=119 time=16.2 ms
[1771060224.121576] 64 bytes from 8.8.8.8: icmp_seq=20 ident=4249 ttl=119 time=12.6 ms

--- 8.8.8.8 ping statistics ---
20 packets transmitted, 20 received, 0% packet loss, time 289ms
rtt min/avg/max/mdev = 10.071/14.760/19.143/2.727 ms, pipe 2, ipg/ewma 15.192/14.356 ms
