ai->ai_family: AF_INET, ai->ai_canonname: '8.8.8.8'
PING 8.8.8.8 (8.8.8.8) 56(84) bytes of data.
[1767949801.522377] 64 bytes from 8.8.8.8: icmp_seq=1 ident=1820 ttl=119 time=18.8 ms
[1767949801.532740] 64 bytes from 8.8.8.8: icmp_seq=2 ident=1820 ttl=119 time=10.2 ms
[1767949801.553518] 64 bytes from 8.8.8.8: icmp_seq=3 ident=1820 ttl=119 time=12.9 ms
[1767949801.572786] 64 bytes from 8.8.8.8: icmp_seq=4 ident=1820 ttl=119 time=15.2 ms
[1767949801.592758] 64 bytes from 8.8.8.8: icmp_seq=5 ident=1820 ttl=119 time=18.2 ms
[1767949801.611975] 64 bytes from 8.8.8.8: icmp_seq=6 ident=1820 ttl=119 time=20.3 ms
[1767949801.620801] 64 bytes from 8.8.8.8: icmp_seq=7 ident=1820 ttl=119 time=11.8 ms
[1767949801.641613] 64 bytes from 8.8.8.8: icmp_seq=8 ident=1820 ttl=119 time=15.6 ms
[1767949801.661556] 64 bytes from 8.8.8.8: icmp_seq=9 ident=1820 ttl=119 time=18.6 ms
[1767949801.680762] 64 bytes from 8.8.8.8: icmp_seq=10 ident=1820 ttl=119 time=20.7 ms
[1767949801.690377] 64 bytes from 8.8.8.8: icmp_seq=11 ident=1820 ttl=119 time=12.6 ms
[1767949801.709778] 64 bytes from 8.8.8.8: icmp_seq=12 ident=1820 ttl=119 time=15.0 ms
[1767949801.729603] 64 bytes from 8.8.8.8: icmp_seq=13 ident=1820 ttl=119 time=17.8 ms
[1767949801.740042] 64 bytes from 8.8.8.8: icmp_seq=14 ident=1820 ttl=119 time=11.2 ms
[1767949801.760063] 64 bytes from 8.8.8.8: icmp_seq=15 ident=1820 ttl=119 time=15.2 ms
[1767949801.778409] 64 bytes from 8.8.8.8: icmp_seq=16 ident=1820 ttl=119 time=17.5 ms
[1767949801.788822] 64 bytes from 8.8.8.8: icmp_seq=17 ident=1820 ttl=119 time=11.8 ms
[1767949801.809592] 64 bytes from 8.8.8.8: icmp_seq=18 ident=1820 ttl=119 time=16.6 ms
[1767949801.828833] 64 bytes from 8.8.8.8: icmp_seq=19 ident=1820 ttl=119 time=19.7 ms
[1767949801.837619] 64 bytes from 8.8.8.8: icmp_seq=20 ident=1820 ttl=119 time=11.9 ms

--- 8.8.8.8 ping statistics ---
20 packets transmitted, 20 received, 0% packet loss, time 322ms
rtt min/avg/max/mdev = 10.162/15.580/20.688/3.228 ms, pipe 2, ipg/ewma 16.958/15.659 ms
ping: sock4.fd: 3 (socktype: SOCK_RAW), sock6.fd: 4 (socktype: SOCK_RAW), hints.ai_family: AF_UNSPEC

ai->ai_family: AF_INET, ai->ai_canonname: '8.8.8.8'
PING 8.8.8.8 (8.8.8.8) 56(84) bytes of data.
[1767949801.876883] 64 bytes from 8.8.8.8: icmp_seq=1 ident=1825 ttl=119 time=16.6 ms
[1767949801.888091] 64 bytes from 8.8.8.8: icmp_seq=2 ident=1825 ttl=119 time=10.8 ms
[1767949801.906762] 64 bytes from 8.8.8.8: icmp_seq=3 ident=1825 ttl=119 time=13.4 ms
[1767949801.926476] 64 bytes from 8.8.8.8: icmp_seq=4 ident=1825 ttl=119 time=17.2 ms
[1767949801.936975] 64 bytes from 8.8.8.8: icmp_seq=5 ident=1825 ttl=119 time=11.6 ms
[1767949801.956892] 64 bytes from 8.8.8.8: icmp_seq=6 ident=1825 ttl=119 time=16.5 ms
[1767949801.976090] 64 bytes from 8.8.8.8: icmp_seq=7 ident=1825 ttl=119 time=20.6 ms
[1767949801.984918] 64 bytes from 8.8.8.8: icmp_seq=8 ident=1825 ttl=119 time=13.8 ms
[1767949802.004911] 64 bytes from 8.8.8.8: icmp_seq=9 ident=1825 ttl=119 time=17.8 ms
[1767949802.016147] 64 bytes from 8.8.8.8: icmp_seq=10 ident=1825 ttl=119 time=12.9 ms
[1767949802.034504] 64 bytes from 8.8.8.8: icmp_seq=11 ident=1825 ttl=119 time=15.3 ms
[1767949802.054536] 64 bytes from 8.8.8.8: icmp_seq=12 ident=1825 ttl=119 time=19.3 ms
[1767949802.064996] 64 bytes from 8.8.8.8: icmp_seq=13 ident=1825 ttl=119 time=13.7 ms
[1767949802.084893] 64 bytes from 8.8.8.8: icmp_seq=14 ident=1825 ttl=119 time=17.6 ms
[1767949802.104928] 64 bytes from 8.8.8.8: icmp_seq=15 ident=1825 ttl=119 time=21.5 ms
[1767949802.112910] 64 bytes from 8.8.8.8: icmp_seq=16 ident=1825 ttl=119 time=12.8 ms
[1767949802.132899] 64 bytes from 8.8.8.8: icmp_seq=17 ident=1825 ttl=119 time=16.8 ms
[1767949802.144114] 64 bytes from 8.8.8.8: icmp_seq=18 ident=1825 ttl=119 time=11.9 ms
[1767949802.162528] 64 bytes from 8.8.8.8: icmp_seq=19 ident=1825 ttl=119 time=14.3 ms
[1767949802.182510] 64 bytes from 8.8.8.8: icmp_seq=20 ident=1825 ttl=119 time=18.3 ms

--- 8.8.8.8 ping statistics ---
20 packets transmitted, 20 received, 0% packet loss, time 304ms
rtt min/avg/max/mdev = 10.777/15.623/21.459/2.962 ms, pipe 2, ipg/ewma 15.996/15.880 ms
ping: sock4.fd: 3 (socktype: SOCK_RAW), sock6.fd: 4 (socktype: SOCK_RAW), hints.ai_family: AF_UNSPEC

ai->ai_family: AF_INET, ai->ai_canonname: '8.8.8.8'
PING 8.8.8.8 (8.8.8.8) 56(84) bytes of data.
[1767949802.694753] 64 bytes from 8.8.8.8: icmp_seq=1 ident=1837 ttl=119 time=19.9 ms
[1767949802.714740] 64 bytes from 8.8.8.8: icmp_seq=2 ident=1837 ttl=119 time=19.9 ms
[1767949802.734096] 64 bytes from 8.8.8.8: icmp_seq=3 ident=1837 ttl=119 time=19.2 ms
[1767949802.753286] 64 bytes from 8.8.8.8: icmp_seq=4 ident=1837 ttl=119 time=18.5 ms
[1767949802.773189] 64 bytes from 8.8.8.8: icmp_seq=5 ident=1837 ttl=119 time=18.3 ms
[1767949802.785134] 64 bytes from 8.8.8.8: icmp_seq=6 ident=1837 ttl=119 time=11.3 ms
[1767949802.802859] 64 bytes from 8.8.8.8: icmp_seq=7 ident=1837 ttl=119 time=11.0 ms
[1767949802.822811] 64 bytes from 8.8.8.8: icmp_seq=8 ident=1837 ttl=119 time=12.9 ms
[1767949802.842859] 64 bytes from 8.8.8.8: icmp_seq=9 ident=1837 ttl=119 time=17.0 ms
[1767949802.861174] 64 bytes from 8.8.8.8: icmp_seq=10 ident=1837 ttl=119 time=18.2 ms
[1767949802.873211] 64 bytes from 8.8.8.8: icmp_seq=11 ident=1837 ttl=119 time=13.1 ms
[1767949802.893262] 64 bytes from 8.8.8.8: icmp_seq=12 ident=1837 ttl=119 time=16.2 ms
[1767949802.912406] 64 bytes from 8.8.8.8: icmp_seq=13 ident=1837 ttl=119 time=18.3 ms
[1767949802.930807] 64 bytes from 8.8.8.8: icmp_seq=14 ident=1837 ttl=119 time=19.6 ms
[1767949802.941252] 64 bytes from 8.8.8.8: icmp_seq=15 ident=1837 ttl=119 time=12.6 ms
[1767949802.961167] 64 bytes from 8.8.8.8: icmp_seq=16 ident=1837 ttl=119 time=15.6 ms
[1767949802.981311] 64 bytes from 8.8.8.8: icmp_seq=17 ident=1837 ttl=119 time=19.7 ms
[1767949802.989313] 64 bytes from 8.8.8.8: icmp_seq=18 ident=1837 ttl=119 time=11.6 ms
[1767949803.009420] 64 bytes from 8.8.8.8: icmp_seq=19 ident=1837 ttl=119 time=15.7 ms
[1767949803.021419] 64 bytes from 8.8.8.8: icmp_seq=20 ident=1837 ttl=119 time=11.7 ms

--- 8.8.8.8 ping statistics ---
20 packets transmitted, 20 received, 0% packet loss, time 335ms
rtt min/avg/max/mdev = 10.997/16.022/19.907/3.194 ms, pipe 2, ipg/ewma 17.624/15.590 ms
ping: sock4.fd: 3 (socktype: SOCK_RAW), sock6.fd: 4 (socktype: SOCK_RAW), hints.ai_family: AF_UNSPEC

ai->ai_family: AF_INET, ai->ai_canonname: '8.8.8.8'
PING 8.8.8.8 (8.8.8.8) 56(84) bytes of data.
[1767949819.365760] 64 bytes from 8.8.8.8: icmp_seq=1 ident=2628 ttl=119 time=15.0 ms
[1767949819.384936] 64 bytes from 8.8.8.8: icmp_seq=2 ident=2628 ttl=119 time=19.1 ms
[1767949819.393708] 64 bytes from 8.8.8.8: icmp_seq=3 ident=2628 ttl=119 time=12.7 ms
[1767949819.413744] 64 bytes from 8.8.8.8: icmp_seq=4 ident=2628 ttl=119 time=17.8 ms
[1767949819.424214] 64 bytes from 8.8.8.8: icmp_seq=5 ident=2628 ttl=119 time=13.1 ms
[1767949819.442538] 64 bytes from 8.8.8.8: icmp_seq=6 ident=2628 ttl=119 time=16.5 ms
[1767949819.453765] 64 bytes from 8.8.8.8: icmp_seq=7 ident=2628 ttl=119 time=12.6 ms
[1767949819.473765] 64 bytes from 8.8.8.8: icmp_seq=8 ident=2628 ttl=119 time=17.6 ms
[1767949819.482562] 64 bytes from 8.8.8.8: icmp_seq=9 ident=2628 ttl=119 time=11.2 ms
[1767949819.501733] 64 bytes from 8.8.8.8: icmp_seq=10 ident=2628 ttl=119 time=15.4 ms
[1767949819.512204] 64 bytes from 8.8.8.8: icmp_seq=11 ident=2628 ttl=119 time=10.8 ms
[1767949819.532969] 64 bytes from 8.8.8.8: icmp_seq=12 ident=2628 ttl=119 time=17.5 ms
[1767949819.541752] 64 bytes from 8.8.8.8: icmp_seq=13 ident=2628 ttl=119 time=12.2 ms
[1767949819.561774] 64 bytes from 8.8.8.8: icmp_seq=14 ident=2628 ttl=119 time=18.2 ms
[1767949819.570580] 64 bytes from 8.8.8.8: icmp_seq=15 ident=2628 ttl=119 time=12.9 ms
[1767949819.589914] 64 bytes from 8.8.8.8: icmp_seq=16 ident=2628 ttl=119 time=17.2 ms
[1767949819.601198] 64 bytes from 8.8.8.8: icmp_seq=17 ident=2628 ttl=119 time=13.4 ms
[1767949819.621012] 64 bytes from 8.8.8.8: icmp_seq=18 ident=2628 ttl=119 time=18.2 ms
[1767949819.629823] 64 bytes from 8.8.8.8: icmp_seq=19 ident=2628 ttl=119 time=11.9 ms
[1767949819.649807] 64 bytes from 8.8.8.8: icmp_seq=20 ident=2628 ttl=119 time=16.9 ms

--- 8.8.8.8 ping statistics ---
20 packets transmitted, 20 received, 0% packet loss, time 282ms
rtt min/avg/max/mdev = 10.755/15.002/19.064/2.643 ms, pipe 2, ipg/ewma 14.854/15.052 ms
