ai->ai_family: AF_INET, ai->ai_canonname: '8.8.8.8'
PING 8.8.8.8 (8.8.8.8) 56(84) bytes of data.
[1769073001.415427] 64 bytes from 8.8.8.8: icmp_seq=1 ident=6523 ttl=119 time=12.0 ms
[1769073001.427586] 64 bytes from 8.8.8.8: icmp_seq=2 ident=6523 ttl=119 time=12.1 ms
[1769073001.444401] 64 bytes from 8.8.8.8: icmp_seq=3 ident=6523 ttl=119 time=16.7 ms
[1769073001.455539] 64 bytes from 8.8.8.8: icmp_seq=4 ident=6523 ttl=119 time=15.8 ms
[1769073001.467596] 64 bytes from 8.8.8.8: icmp_seq=5 ident=6523 ttl=119 time=13.0 ms
[1769073001.483453] 64 bytes from 8.8.8.8: icmp_seq=6 ident=6523 ttl=119 time=15.8 ms
[1769073001.495418] 64 bytes from 8.8.8.8: icmp_seq=7 ident=6523 ttl=119 time=14.6 ms
[1769073001.515458] 64 bytes from 8.8.8.8: icmp_seq=8 ident=6523 ttl=119 time=20.8 ms
[1769073001.523491] 64 bytes from 8.8.8.8: icmp_seq=9 ident=6523 ttl=119 time=13.9 ms
[1769073001.535484] 64 bytes from 8.8.8.8: icmp_seq=10 ident=6523 ttl=119 time=11.9 ms
[1769073001.555437] 64 bytes from 8.8.8.8: icmp_seq=11 ident=6523 ttl=119 time=17.8 ms
[1769073001.563444] 64 bytes from 8.8.8.8: icmp_seq=12 ident=6523 ttl=119 time=11.7 ms
[1769073001.583442] 64 bytes from 8.8.8.8: icmp_seq=13 ident=6523 ttl=119 time=17.7 ms
[1769073001.592260] 64 bytes from 8.8.8.8: icmp_seq=14 ident=6523 ttl=119 time=12.4 ms
[1769073001.603451] 64 bytes from 8.8.8.8: icmp_seq=15 ident=6523 ttl=119 time=9.63 ms
[1769073001.623473] 64 bytes from 8.8.8.8: icmp_seq=16 ident=6523 ttl=119 time=15.6 ms
[1769073001.631463] 64 bytes from 8.8.8.8: icmp_seq=17 ident=6523 ttl=119 time=9.52 ms
[1769073001.651471] 64 bytes from 8.8.8.8: icmp_seq=18 ident=6523 ttl=119 time=16.5 ms
[1769073001.663458] 64 bytes from 8.8.8.8: icmp_seq=19 ident=6523 ttl=119 time=15.4 ms
[1769073001.683491] 64 bytes from 8.8.8.8: icmp_seq=20 ident=6523 ttl=119 time=20.8 ms

--- 8.8.8.8 ping statistics ---
20 packets transmitted, 20 received, 0% packet loss, time 259ms
rtt min/avg/max/mdev = 9.515/14.700/20.841/3.143 ms, pipe 2, ipg/ewma 13.644/14.872 ms
ping: sock4.fd: 3 (socktype: SOCK_RAW), sock6.fd: 4 (socktype: SOCK_RAW), hints.ai_family: AF_UNSPEC

ai->ai_family: AF_INET, ai->ai_canonname: '8.8.8.8'
PING 8.8.8.8 (8.8.8.8) 56(84) bytes of data.
[1769073001.720363] 64 bytes from 8.8.8.8: icmp_seq=1 ident=6528 ttl=119 time=14.5 ms
[1769073001.731539] 64 bytes from 8.8.8.8: icmp_seq=2 ident=6528 ttl=119 time=10.7 ms
[1769073001.751503] 64 bytes from 8.8.8.8: icmp_seq=3 ident=6528 ttl=119 time=16.7 ms
[1769073001.759465] 64 bytes from 8.8.8.8: icmp_seq=4 ident=6528 ttl=119 time=10.5 ms
[1769073001.779519] 64 bytes from 8.8.8.8: icmp_seq=5 ident=6528 ttl=119 time=16.6 ms
[1769073001.791543] 64 bytes from 8.8.8.8: icmp_seq=6 ident=6528 ttl=119 time=14.5 ms
[1769073001.811449] 64 bytes from 8.8.8.8: icmp_seq=7 ident=6528 ttl=119 time=19.8 ms
[1769073001.819512] 64 bytes from 8.8.8.8: icmp_seq=8 ident=6528 ttl=119 time=13.8 ms
[1769073001.839530] 64 bytes from 8.8.8.8: icmp_seq=9 ident=6528 ttl=119 time=18.8 ms
[1769073001.848263] 64 bytes from 8.8.8.8: icmp_seq=10 ident=6528 ttl=119 time=12.4 ms
[1769073001.867460] 64 bytes from 8.8.8.8: icmp_seq=11 ident=6528 ttl=119 time=16.7 ms
[1769073001.879475] 64 bytes from 8.8.8.8: icmp_seq=12 ident=6528 ttl=119 time=13.6 ms
[1769073001.899481] 64 bytes from 8.8.8.8: icmp_seq=13 ident=6528 ttl=119 time=18.6 ms
[1769073001.907461] 64 bytes from 8.8.8.8: icmp_seq=14 ident=6528 ttl=119 time=11.5 ms
[1769073001.927474] 64 bytes from 8.8.8.8: icmp_seq=15 ident=6528 ttl=119 time=16.5 ms
[1769073001.939466] 64 bytes from 8.8.8.8: icmp_seq=16 ident=6528 ttl=119 time=13.4 ms
[1769073001.956294] 64 bytes from 8.8.8.8: icmp_seq=17 ident=6528 ttl=119 time=15.2 ms
[1769073001.967492] 64 bytes from 8.8.8.8: icmp_seq=18 ident=6528 ttl=119 time=11.3 ms
[1769073001.987501] 64 bytes from 8.8.8.8: icmp_seq=19 ident=6528 ttl=119 time=16.4 ms
[1769073001.998691] 64 bytes from 8.8.8.8: icmp_seq=20 ident=6528 ttl=119 time=12.5 ms

--- 8.8.8.8 ping statistics ---
20 packets transmitted, 20 received, 0% packet loss, time 280ms
rtt min/avg/max/mdev = 10.544/14.709/19.839/2.688 ms, pipe 2, ipg/ewma 14.759/14.456 ms
ping: sock4.fd: 3 (socktype: SOCK_RAW), sock6.fd: 4 (socktype: SOCK_RAW), hints.ai_family: AF_UNSPEC

ai->ai_family: AF_INET, ai->ai_canonname: '8.8.8.8'
PING 8.8.8.8 (8.8.8.8) 56(84) bytes of data.
[1769073002.547161] 64 bytes from 8.8.8.8: icmp_seq=1 ident=6540 ttl=119 time=16.2 ms
[1769073002.559999] 64 bytes from 8.8.8.8: icmp_seq=2 ident=6540 ttl=119 time=12.8 ms
[1769073002.581642] 64 bytes from 8.8.8.8: icmp_seq=3 ident=6540 ttl=119 time=18.4 ms
[1769073002.596311] 64 bytes from 8.8.8.8: icmp_seq=4 ident=6540 ttl=119 time=17.0 ms
[1769073002.607975] 64 bytes from 8.8.8.8: icmp_seq=5 ident=6540 ttl=119 time=12.2 ms
[1769073002.628234] 64 bytes from 8.8.8.8: icmp_seq=6 ident=6540 ttl=119 time=16.4 ms
[1769073002.639233] 64 bytes from 8.8.8.8: icmp_seq=7 ident=6540 ttl=119 time=11.3 ms
[1769073002.656579] 64 bytes from 8.8.8.8: icmp_seq=8 ident=6540 ttl=119 time=13.7 ms
[1769073002.675182] 64 bytes from 8.8.8.8: icmp_seq=9 ident=6540 ttl=119 time=17.3 ms
[1769073002.688004] 64 bytes from 8.8.8.8: icmp_seq=10 ident=6540 ttl=119 time=15.0 ms
[1769073002.707660] 64 bytes from 8.8.8.8: icmp_seq=11 ident=6540 ttl=119 time=19.6 ms
[1769073002.715985] 64 bytes from 8.8.8.8: icmp_seq=12 ident=6540 ttl=119 time=12.8 ms
[1769073002.735987] 64 bytes from 8.8.8.8: icmp_seq=13 ident=6540 ttl=119 time=17.8 ms
[1769073002.744838] 64 bytes from 8.8.8.8: icmp_seq=14 ident=6540 ttl=119 time=11.5 ms
[1769073002.763867] 64 bytes from 8.8.8.8: icmp_seq=15 ident=6540 ttl=119 time=15.6 ms
[1769073002.776019] 64 bytes from 8.8.8.8: icmp_seq=16 ident=6540 ttl=119 time=12.6 ms
[1769073002.796010] 64 bytes from 8.8.8.8: icmp_seq=17 ident=6540 ttl=119 time=17.6 ms
[1769073002.803999] 64 bytes from 8.8.8.8: icmp_seq=18 ident=6540 ttl=119 time=10.5 ms
[1769073002.823598] 64 bytes from 8.8.8.8: icmp_seq=19 ident=6540 ttl=119 time=15.1 ms
[1769073002.836047] 64 bytes from 8.8.8.8: icmp_seq=20 ident=6540 ttl=119 time=12.4 ms

--- 8.8.8.8 ping statistics ---
20 packets transmitted, 20 received, 0% packet loss, time 293ms
rtt min/avg/max/mdev = 10.490/14.779/19.584/2.619 ms, pipe 2, ipg/ewma 15.408/14.425 ms
ping: sock4.fd: 3 (socktype: SOCK_RAW), sock6.fd: 4 (socktype: SOCK_RAW), hints.ai_family: AF_UNSPEC

ai->ai_family: AF_INET, ai->ai_canonname: '8.8.8.8'
PING 8.8.8.8 (8.8.8.8) 56(84) bytes of data.
[1769073018.675498] 64 bytes from 8.8.8.8: icmp_seq=1 ident=7334 ttl=119 time=12.0 ms
[1769073018.687462] 64 bytes from 8.8.8.8: icmp_seq=2 ident=7334 ttl=119 time=11.9 ms
[1769073018.707562] 64 bytes from 8.8.8.8: icmp_seq=3 ident=7334 ttl=119 time=20.0 ms
[1769073018.714674] 64 bytes from 8.8.8.8: icmp_seq=4 ident=7334 ttl=119 time=15.0 ms
[1769073018.735475] 64 bytes from 8.8.8.8: icmp_seq=5 ident=7334 ttl=119 time=20.7 ms
[1769073018.744251] 64 bytes from 8.8.8.8: icmp_seq=6 ident=7334 ttl=119 time=16.4 ms
[1769073018.755496] 64 bytes from 8.8.8.8: icmp_seq=7 ident=7334 ttl=119 time=11.1 ms
[1769073018.775455] 64 bytes from 8.8.8.8: icmp_seq=8 ident=7334 ttl=119 time=17.1 ms
[1769073018.783500] 64 bytes from 8.8.8.8: icmp_seq=9 ident=7334 ttl=119 time=11.0 ms
[1769073018.803460] 64 bytes from 8.8.8.8: icmp_seq=10 ident=7334 ttl=119 time=17.0 ms
[1769073018.815475] 64 bytes from 8.8.8.8: icmp_seq=11 ident=7334 ttl=119 time=14.9 ms
[1769073018.835485] 64 bytes from 8.8.8.8: icmp_seq=12 ident=7334 ttl=119 time=19.9 ms
[1769073018.842726] 64 bytes from 8.8.8.8: icmp_seq=13 ident=7334 ttl=119 time=13.0 ms
[1769073018.863468] 64 bytes from 8.8.8.8: icmp_seq=14 ident=7334 ttl=119 time=18.8 ms
[1769073018.872297] 64 bytes from 8.8.8.8: icmp_seq=15 ident=7334 ttl=119 time=12.5 ms
[1769073018.891489] 64 bytes from 8.8.8.8: icmp_seq=16 ident=7334 ttl=119 time=16.7 ms
[1769073018.903498] 64 bytes from 8.8.8.8: icmp_seq=17 ident=7334 ttl=119 time=13.6 ms
[1769073018.923503] 64 bytes from 8.8.8.8: icmp_seq=18 ident=7334 ttl=119 time=18.6 ms
[1769073018.931572] 64 bytes from 8.8.8.8: icmp_seq=19 ident=7334 ttl=119 time=11.5 ms
[1769073018.951563] 64 bytes from 8.8.8.8: icmp_seq=20 ident=7334 ttl=119 time=16.5 ms

--- 8.8.8.8 ping statistics ---
20 packets transmitted, 20 received, 0% packet loss, time 272ms
rtt min/avg/max/mdev = 11.025/15.400/20.701/3.116 ms, pipe 2, ipg/ewma 14.295/15.143 ms
