ai->ai_family: AF_INET, ai->ai_canonname: '8.8.8.8'
PING 8.8.8.8 (8.8.8.8) 56(84) bytes of data.
[1772262601.265911] 64 bytes from 8.8.8.8: icmp_seq=1 ident=2500 ttl=119 time=14.8 ms
[1772262601.276246] 64 bytes from 8.8.8.8: icmp_seq=2 ident=2500 ttl=119 time=10.2 ms
[1772262601.295385] 64 bytes from 8.8.8.8: icmp_seq=3 ident=2500 ttl=119 time=15.3 ms
[1772262601.304297] 64 bytes from 8.8.8.8: icmp_seq=4 ident=2500 ttl=119 time=10.1 ms
[1772262601.324265] 64 bytes from 8.8.8.8: icmp_seq=5 ident=2500 ttl=119 time=16.1 ms
[1772262601.333869] 64 bytes from 8.8.8.8: icmp_seq=6 ident=2500 ttl=119 time=11.5 ms
[1772262601.353869] 64 bytes from 8.8.8.8: icmp_seq=7 ident=2500 ttl=119 time=17.5 ms
[1772262601.364274] 64 bytes from 8.8.8.8: icmp_seq=8 ident=2500 ttl=119 time=13.8 ms
[1772262601.384270] 64 bytes from 8.8.8.8: icmp_seq=9 ident=2500 ttl=119 time=19.8 ms
[1772262601.393082] 64 bytes from 8.8.8.8: icmp_seq=10 ident=2500 ttl=119 time=14.5 ms
[1772262601.404262] 64 bytes from 8.8.8.8: icmp_seq=11 ident=2500 ttl=119 time=10.6 ms
[1772262601.423540] 64 bytes from 8.8.8.8: icmp_seq=12 ident=2500 ttl=119 time=16.0 ms
[1772262601.432297] 64 bytes from 8.8.8.8: icmp_seq=13 ident=2500 ttl=119 time=10.6 ms
[1772262601.452296] 64 bytes from 8.8.8.8: icmp_seq=14 ident=2500 ttl=119 time=16.6 ms
[1772262601.461923] 64 bytes from 8.8.8.8: icmp_seq=15 ident=2500 ttl=119 time=12.1 ms
[1772262601.481948] 64 bytes from 8.8.8.8: icmp_seq=16 ident=2500 ttl=119 time=18.1 ms
[1772262601.492306] 64 bytes from 8.8.8.8: icmp_seq=17 ident=2500 ttl=119 time=14.4 ms
[1772262601.512325] 64 bytes from 8.8.8.8: icmp_seq=18 ident=2500 ttl=119 time=19.4 ms
[1772262601.521147] 64 bytes from 8.8.8.8: icmp_seq=19 ident=2500 ttl=119 time=13.1 ms
[1772262601.541133] 64 bytes from 8.8.8.8: icmp_seq=20 ident=2500 ttl=119 time=18.1 ms

--- 8.8.8.8 ping statistics ---
20 packets transmitted, 20 received, 0% packet loss, time 272ms
rtt min/avg/max/mdev = 10.078/14.628/19.824/3.020 ms, pipe 2, ipg/ewma 14.313/15.300 ms
ping: sock4.fd: 3 (socktype: SOCK_RAW), sock6.fd: 4 (socktype: SOCK_RAW), hints.ai_family: AF_UNSPEC

ai->ai_family: AF_INET, ai->ai_canonname: '8.8.8.8'
PING 8.8.8.8 (8.8.8.8) 56(84) bytes of data.
[1772262601.580398] 64 bytes from 8.8.8.8: icmp_seq=1 ident=2505 ttl=119 time=16.2 ms
[1772262601.600330] 64 bytes from 8.8.8.8: icmp_seq=2 ident=2505 ttl=119 time=19.8 ms
[1772262601.609972] 64 bytes from 8.8.8.8: icmp_seq=3 ident=2505 ttl=119 time=13.4 ms
[1772262601.629140] 64 bytes from 8.8.8.8: icmp_seq=4 ident=2505 ttl=119 time=16.5 ms
[1772262601.640371] 64 bytes from 8.8.8.8: icmp_seq=5 ident=2505 ttl=119 time=11.7 ms
[1772262601.660329] 64 bytes from 8.8.8.8: icmp_seq=6 ident=2505 ttl=119 time=15.6 ms
[1772262601.678790] 64 bytes from 8.8.8.8: icmp_seq=7 ident=2505 ttl=119 time=18.1 ms
[1772262601.688364] 64 bytes from 8.8.8.8: icmp_seq=8 ident=2505 ttl=119 time=11.5 ms
[1772262601.708426] 64 bytes from 8.8.8.8: icmp_seq=9 ident=2505 ttl=119 time=16.6 ms
[1772262601.717953] 64 bytes from 8.8.8.8: icmp_seq=10 ident=2505 ttl=119 time=11.0 ms
[1772262601.737184] 64 bytes from 8.8.8.8: icmp_seq=11 ident=2505 ttl=119 time=15.2 ms
[1772262601.748404] 64 bytes from 8.8.8.8: icmp_seq=12 ident=2505 ttl=119 time=11.3 ms
[1772262601.768410] 64 bytes from 8.8.8.8: icmp_seq=13 ident=2505 ttl=119 time=16.3 ms
[1772262601.777193] 64 bytes from 8.8.8.8: icmp_seq=14 ident=2505 ttl=119 time=9.97 ms
[1772262601.797189] 64 bytes from 8.8.8.8: icmp_seq=15 ident=2505 ttl=119 time=16.0 ms
[1772262601.806799] 64 bytes from 8.8.8.8: icmp_seq=16 ident=2505 ttl=119 time=11.5 ms
[1772262601.826014] 64 bytes from 8.8.8.8: icmp_seq=17 ident=2505 ttl=119 time=16.7 ms
[1772262601.836422] 64 bytes from 8.8.8.8: icmp_seq=18 ident=2505 ttl=119 time=13.0 ms
[1772262601.856450] 64 bytes from 8.8.8.8: icmp_seq=19 ident=2505 ttl=119 time=19.0 ms
[1772262601.865266] 64 bytes from 8.8.8.8: icmp_seq=20 ident=2505 ttl=119 time=13.7 ms

--- 8.8.8.8 ping statistics ---
20 packets transmitted, 20 received, 0% packet loss, time 287ms
rtt min/avg/max/mdev = 9.972/14.644/19.837/2.810 ms, pipe 2, ipg/ewma 15.123/14.656 ms
ping: sock4.fd: 3 (socktype: SOCK_RAW), sock6.fd: 4 (socktype: SOCK_RAW), hints.ai_family: AF_UNSPEC

ai->ai_family: AF_INET, ai->ai_canonname: '8.8.8.8'
PING 8.8.8.8 (8.8.8.8) 56(84) bytes of data.
[1772262603.037824] 64 bytes from 8.8.8.8: icmp_seq=1 ident=2518 ttl=119 time=17.2 ms
[1772262603.049016] 64 bytes from 8.8.8.8: icmp_seq=2 ident=2518 ttl=119 time=11.1 ms
[1772262603.067416] 64 bytes from 8.8.8.8: icmp_seq=3 ident=2518 ttl=119 time=13.5 ms
[1772262603.087317] 64 bytes from 8.8.8.8: icmp_seq=4 ident=2518 ttl=119 time=17.4 ms
[1772262603.097851] 64 bytes from 8.8.8.8: icmp_seq=5 ident=2518 ttl=119 time=11.8 ms
[1772262603.117007] 64 bytes from 8.8.8.8: icmp_seq=6 ident=2518 ttl=119 time=15.0 ms
[1772262603.137009] 64 bytes from 8.8.8.8: icmp_seq=7 ident=2518 ttl=119 time=19.0 ms
[1772262603.145887] 64 bytes from 8.8.8.8: icmp_seq=8 ident=2518 ttl=119 time=11.7 ms
[1772262603.165767] 64 bytes from 8.8.8.8: icmp_seq=9 ident=2518 ttl=119 time=16.6 ms
[1772262603.177054] 64 bytes from 8.8.8.8: icmp_seq=10 ident=2518 ttl=119 time=12.8 ms
[1772262603.197037] 64 bytes from 8.8.8.8: icmp_seq=11 ident=2518 ttl=119 time=17.8 ms
[1772262603.205079] 64 bytes from 8.8.8.8: icmp_seq=12 ident=2518 ttl=119 time=10.7 ms
[1772262603.224984] 64 bytes from 8.8.8.8: icmp_seq=13 ident=2518 ttl=119 time=15.6 ms
[1772262603.244237] 64 bytes from 8.8.8.8: icmp_seq=14 ident=2518 ttl=119 time=19.7 ms
[1772262603.253869] 64 bytes from 8.8.8.8: icmp_seq=15 ident=2518 ttl=119 time=13.7 ms
[1772262603.273867] 64 bytes from 8.8.8.8: icmp_seq=16 ident=2518 ttl=119 time=18.7 ms
[1772262603.285090] 64 bytes from 8.8.8.8: icmp_seq=17 ident=2518 ttl=119 time=14.8 ms
[1772262603.304214] 64 bytes from 8.8.8.8: icmp_seq=18 ident=2518 ttl=119 time=17.9 ms
[1772262603.313076] 64 bytes from 8.8.8.8: icmp_seq=19 ident=2518 ttl=119 time=10.7 ms
[1772262603.333080] 64 bytes from 8.8.8.8: icmp_seq=20 ident=2518 ttl=119 time=15.7 ms

--- 8.8.8.8 ping statistics ---
20 packets transmitted, 20 received, 0% packet loss, time 297ms
rtt min/avg/max/mdev = 10.656/15.059/19.735/2.864 ms, pipe 2, ipg/ewma 15.620/15.334 ms
ping: sock4.fd: 3 (socktype: SOCK_RAW), sock6.fd: 4 (socktype: SOCK_RAW), hints.ai_family: AF_UNSPEC

ai->ai_family: AF_INET, ai->ai_canonname: '8.8.8.8'
PING 8.8.8.8 (8.8.8.8) 56(84) bytes of data.
[1772262618.961237] 64 bytes from 8.8.8.8: icmp_seq=1 ident=3313 ttl=119 time=12.1 ms
[1772262618.977979] 64 bytes from 8.8.8.8: icmp_seq=2 ident=3313 ttl=119 time=16.6 ms
[1772262618.989151] 64 bytes from 8.8.8.8: icmp_seq=3 ident=3313 ttl=119 time=15.7 ms
[1772262618.997967] 64 bytes from 8.8.8.8: icmp_seq=4 ident=3313 ttl=119 time=9.83 ms
[1772262619.017194] 64 bytes from 8.8.8.8: icmp_seq=5 ident=3313 ttl=119 time=16.1 ms
[1772262619.029186] 64 bytes from 8.8.8.8: icmp_seq=6 ident=3313 ttl=119 time=14.9 ms
[1772262619.037190] 64 bytes from 8.8.8.8: icmp_seq=7 ident=3313 ttl=119 time=9.81 ms
[1772262619.057212] 64 bytes from 8.8.8.8: icmp_seq=8 ident=3313 ttl=119 time=16.8 ms
[1772262619.066792] 64 bytes from 8.8.8.8: icmp_seq=9 ident=3313 ttl=119 time=13.3 ms
[1772262619.077208] 64 bytes from 8.8.8.8: icmp_seq=10 ident=3313 ttl=119 time=10.3 ms
[1772262619.096404] 64 bytes from 8.8.8.8: icmp_seq=11 ident=3313 ttl=119 time=16.5 ms
[1772262619.105992] 64 bytes from 8.8.8.8: icmp_seq=12 ident=3313 ttl=119 time=13.0 ms
[1772262619.117214] 64 bytes from 8.8.8.8: icmp_seq=13 ident=3313 ttl=119 time=11.1 ms
[1772262619.137287] 64 bytes from 8.8.8.8: icmp_seq=14 ident=3313 ttl=119 time=18.2 ms
[1772262619.145250] 64 bytes from 8.8.8.8: icmp_seq=15 ident=3313 ttl=119 time=13.1 ms
[1772262619.157256] 64 bytes from 8.8.8.8: icmp_seq=16 ident=3313 ttl=119 time=11.1 ms
[1772262619.177266] 64 bytes from 8.8.8.8: icmp_seq=17 ident=3313 ttl=119 time=18.1 ms
[1772262619.185257] 64 bytes from 8.8.8.8: icmp_seq=18 ident=3313 ttl=119 time=13.0 ms
[1772262619.205238] 64 bytes from 8.8.8.8: icmp_seq=19 ident=3313 ttl=119 time=19.0 ms
[1772262619.214843] 64 bytes from 8.8.8.8: icmp_seq=20 ident=3313 ttl=119 time=14.4 ms

--- 8.8.8.8 ping statistics ---
20 packets transmitted, 20 received, 0% packet loss, time 251ms
rtt min/avg/max/mdev = 9.808/14.145/18.958/2.829 ms, pipe 2, ipg/ewma 13.228/14.443 ms
