ai->ai_family: AF_INET, ai->ai_canonname: '8.8.8.8'
PING 8.8.8.8 (8.8.8.8) 56(84) bytes of data.
[1767820201.293878] 64 bytes from 8.8.8.8: icmp_seq=1 ident=25044 ttl=119 time=18.3 ms
[1767820201.313820] 64 bytes from 8.8.8.8: icmp_seq=2 ident=25044 ttl=119 time=19.8 ms
[1767820201.333880] 64 bytes from 8.8.8.8: icmp_seq=3 ident=25044 ttl=119 time=21.8 ms
[1767820201.351501] 64 bytes from 8.8.8.8: icmp_seq=4 ident=25044 ttl=119 time=19.5 ms
[1767820201.361913] 64 bytes from 8.8.8.8: icmp_seq=5 ident=25044 ttl=119 time=10.3 ms
[1767820201.381956] 64 bytes from 8.8.8.8: icmp_seq=6 ident=25044 ttl=119 time=12.3 ms
[1767820201.401898] 64 bytes from 8.8.8.8: icmp_seq=7 ident=25044 ttl=119 time=15.3 ms
[1767820201.421963] 64 bytes from 8.8.8.8: icmp_seq=8 ident=25044 ttl=119 time=18.3 ms
[1767820201.442006] 64 bytes from 8.8.8.8: icmp_seq=9 ident=25044 ttl=119 time=21.3 ms
[1767820201.450026] 64 bytes from 8.8.8.8: icmp_seq=10 ident=25044 ttl=119 time=11.9 ms
[1767820201.470057] 64 bytes from 8.8.8.8: icmp_seq=11 ident=25044 ttl=119 time=14.9 ms
[1767820201.489954] 64 bytes from 8.8.8.8: icmp_seq=12 ident=25044 ttl=119 time=17.8 ms
[1767820201.509963] 64 bytes from 8.8.8.8: icmp_seq=13 ident=25044 ttl=119 time=20.7 ms
[1767820201.518779] 64 bytes from 8.8.8.8: icmp_seq=14 ident=25044 ttl=119 time=11.6 ms
[1767820201.538744] 64 bytes from 8.8.8.8: icmp_seq=15 ident=25044 ttl=119 time=14.6 ms
[1767820201.558730] 64 bytes from 8.8.8.8: icmp_seq=16 ident=25044 ttl=119 time=18.6 ms
[1767820201.569952] 64 bytes from 8.8.8.8: icmp_seq=17 ident=25044 ttl=119 time=13.7 ms
[1767820201.589934] 64 bytes from 8.8.8.8: icmp_seq=18 ident=25044 ttl=119 time=17.7 ms
[1767820201.607540] 64 bytes from 8.8.8.8: icmp_seq=19 ident=25044 ttl=119 time=19.1 ms
[1767820201.617954] 64 bytes from 8.8.8.8: icmp_seq=20 ident=25044 ttl=119 time=12.8 ms

--- 8.8.8.8 ping statistics ---
20 packets transmitted, 20 received, 0% packet loss, time 330ms
rtt min/avg/max/mdev = 10.283/16.505/21.757/3.460 ms, pipe 2, ipg/ewma 17.348/16.269 ms
ping: sock4.fd: 3 (socktype: SOCK_RAW), sock6.fd: 4 (socktype: SOCK_RAW), hints.ai_family: AF_UNSPEC

ai->ai_family: AF_INET, ai->ai_canonname: '8.8.8.8'
PING 8.8.8.8 (8.8.8.8) 56(84) bytes of data.
[1767820201.658006] 64 bytes from 8.8.8.8: icmp_seq=1 ident=25049 ttl=119 time=17.5 ms
[1767820201.677971] 64 bytes from 8.8.8.8: icmp_seq=2 ident=25049 ttl=119 time=19.8 ms
[1767820201.686844] 64 bytes from 8.8.8.8: icmp_seq=3 ident=25049 ttl=119 time=11.6 ms
[1767820201.705994] 64 bytes from 8.8.8.8: icmp_seq=4 ident=25049 ttl=119 time=13.8 ms
[1767820201.725980] 64 bytes from 8.8.8.8: icmp_seq=5 ident=25049 ttl=119 time=17.7 ms
[1767820201.735607] 64 bytes from 8.8.8.8: icmp_seq=6 ident=25049 ttl=119 time=10.3 ms
[1767820201.754812] 64 bytes from 8.8.8.8: icmp_seq=7 ident=25049 ttl=119 time=13.5 ms
[1767820201.774814] 64 bytes from 8.8.8.8: icmp_seq=8 ident=25049 ttl=119 time=17.5 ms
[1767820201.786072] 64 bytes from 8.8.8.8: icmp_seq=9 ident=25049 ttl=119 time=12.6 ms
[1767820201.806028] 64 bytes from 8.8.8.8: icmp_seq=10 ident=25049 ttl=119 time=17.6 ms
[1767820201.814804] 64 bytes from 8.8.8.8: icmp_seq=11 ident=25049 ttl=119 time=11.2 ms
[1767820201.833998] 64 bytes from 8.8.8.8: icmp_seq=12 ident=25049 ttl=119 time=15.4 ms
[1767820201.846031] 64 bytes from 8.8.8.8: icmp_seq=13 ident=25049 ttl=119 time=12.3 ms
[1767820201.863603] 64 bytes from 8.8.8.8: icmp_seq=14 ident=25049 ttl=119 time=14.9 ms
[1767820201.874061] 64 bytes from 8.8.8.8: icmp_seq=15 ident=25049 ttl=119 time=10.4 ms
[1767820201.894034] 64 bytes from 8.8.8.8: icmp_seq=16 ident=25049 ttl=119 time=16.3 ms
[1767820201.902841] 64 bytes from 8.8.8.8: icmp_seq=17 ident=25049 ttl=119 time=11.0 ms
[1767820201.922856] 64 bytes from 8.8.8.8: icmp_seq=18 ident=25049 ttl=119 time=17.0 ms
[1767820201.933982] 64 bytes from 8.8.8.8: icmp_seq=19 ident=25049 ttl=119 time=14.1 ms
[1767820201.954076] 64 bytes from 8.8.8.8: icmp_seq=20 ident=25049 ttl=119 time=20.0 ms

--- 8.8.8.8 ping statistics ---
20 packets transmitted, 20 received, 0% packet loss, time 294ms
rtt min/avg/max/mdev = 10.257/14.722/19.995/3.018 ms, pipe 2, ipg/ewma 15.451/15.110 ms
ping: sock4.fd: 3 (socktype: SOCK_RAW), sock6.fd: 4 (socktype: SOCK_RAW), hints.ai_family: AF_UNSPEC

ai->ai_family: AF_INET, ai->ai_canonname: '8.8.8.8'
PING 8.8.8.8 (8.8.8.8) 56(84) bytes of data.
[1767820203.105707] 64 bytes from 8.8.8.8: icmp_seq=1 ident=25061 ttl=119 time=12.8 ms
[1767820203.125839] 64 bytes from 8.8.8.8: icmp_seq=2 ident=25061 ttl=119 time=20.0 ms
[1767820203.133879] 64 bytes from 8.8.8.8: icmp_seq=3 ident=25061 ttl=119 time=14.9 ms
[1767820203.145880] 64 bytes from 8.8.8.8: icmp_seq=4 ident=25061 ttl=119 time=11.9 ms
[1767820203.163505] 64 bytes from 8.8.8.8: icmp_seq=5 ident=25061 ttl=119 time=15.5 ms
[1767820203.174697] 64 bytes from 8.8.8.8: icmp_seq=6 ident=25061 ttl=119 time=12.6 ms
[1767820203.193859] 64 bytes from 8.8.8.8: icmp_seq=7 ident=25061 ttl=119 time=17.7 ms
[1767820203.202748] 64 bytes from 8.8.8.8: icmp_seq=8 ident=25061 ttl=119 time=12.5 ms
[1767820203.225597] 64 bytes from 8.8.8.8: icmp_seq=9 ident=25061 ttl=119 time=21.3 ms
[1767820203.233899] 64 bytes from 8.8.8.8: icmp_seq=10 ident=25061 ttl=119 time=15.5 ms
[1767820203.253911] 64 bytes from 8.8.8.8: icmp_seq=11 ident=25061 ttl=119 time=19.9 ms
[1767820203.261860] 64 bytes from 8.8.8.8: icmp_seq=12 ident=25061 ttl=119 time=12.7 ms
[1767820203.282651] 64 bytes from 8.8.8.8: icmp_seq=13 ident=25061 ttl=119 time=18.5 ms
[1767820203.291484] 64 bytes from 8.8.8.8: icmp_seq=14 ident=25061 ttl=119 time=12.2 ms
[1767820203.310603] 64 bytes from 8.8.8.8: icmp_seq=15 ident=25061 ttl=119 time=16.4 ms
[1767820203.321957] 64 bytes from 8.8.8.8: icmp_seq=16 ident=25061 ttl=119 time=12.6 ms
[1767820203.341817] 64 bytes from 8.8.8.8: icmp_seq=17 ident=25061 ttl=119 time=17.5 ms
[1767820203.350709] 64 bytes from 8.8.8.8: icmp_seq=18 ident=25061 ttl=119 time=11.2 ms
[1767820203.369899] 64 bytes from 8.8.8.8: icmp_seq=19 ident=25061 ttl=119 time=15.4 ms
[1767820203.381948] 64 bytes from 8.8.8.8: icmp_seq=20 ident=25061 ttl=119 time=12.3 ms

--- 8.8.8.8 ping statistics ---
20 packets transmitted, 20 received, 0% packet loss, time 277ms
rtt min/avg/max/mdev = 11.227/15.173/21.343/3.026 ms, pipe 2, ipg/ewma 14.565/14.568 ms
